Cites,Authors,Title,Year,Source,Publisher,ArticleURL,CitesURL,GSRank,QueryDate,Type,DOI,ISSN,CitationURL,Volume,Issue,StartPage,EndPage,ECC,CitesPerYear,CitesPerAuthor,AuthorCount,Age,Abstract,FullTextURL,RelatedURL
0,"Soumya Ghosh, Zainab T Al-Sharify, Mathabatha Frank Maleka, Helen Onyeaka, Maleke Maleke, Alhaji Maolloum, Liliana Godoy, Maryam Meskini, Mina Rezghi Rami, Shabnam Ahmadi, Shahad Z Al-Najjar, Noor T Al-Sharify, Sura M Ahmed, Mohammad Hadi Dehghani","Propolis efficacy on SARS-COV viruses: a review on antimicrobial activities and molecular simulations",2022,"Environmental science and pollution research international","","","",73,"2026-01-24 10:13:04","Journal Article","10.1007/s11356-022-21652-6","1614-7499",,29,39,58628,58647,0,0.00,0,14,4,"This current study review provides a brief review of a natural bee product known as propolis and its relevance toward combating SARS-CoV viruses. Propolis has been utilized in medicinal products for centuries due to its excellent biological properties. These include anti-oxidant, immunomodulatory, anti-inflammatory, anti-viral, anti-fungal, and bactericidal activities. Furthermore, studies on molecular simulations show that flavonoids in propolis may reduce viral replication. While further research is needed to validate this theory, it has been observed that COVID-19 patients receiving propolis show earlier viral clearance, enhanced symptom recovery, quicker discharge from hospitals, and a reduced mortality rate relative to other patients. As a result, it appears that propolis could probably be useful in the treatment of SARS-CoV-2-infected patients. Therefore, this review sought to explore the natural properties of propolis and further evaluated past studies that investigated propolis as an alternative product for the treatment of COVID-19 symptoms. In addition, the review also highlights the possible mode of propolis action as well as molecular simulations of propolis compounds that may interact with the SARS-CoV-2 virus. The activity of propolis compounds in decreasing the impact of COVID-19-related comorbidities, the possible roles of such compounds as COVID-19 vaccine adjuvants, and the use of nutraceuticals in COVID-19 treatment, instead of pharmaceuticals, has also been discussed.","",""
0,"Ronny Lesmana, Felix Zulhendri, James Fearnley, Ilham A Irsyam, Renaldi P H N Rasyid, Trimurni Abidin, Rizky Abdulah, Auliya Suwantika, Anant Paradkar, Arief S Budiman, Timotius Pasang","The Suitability of Propolis as a Bioactive Component of Biomaterials",2022,"Frontiers in pharmacology","","","",74,"2026-01-24 10:13:04","Journal Article","10.3389/fphar.2022.930515","1663-9812",,13,,930515,,0,0.00,0,11,4,"Propolis is a resinous product collected by bees from plant exudates to protect and maintain hive homeostasis. Propolis has been used therapeutically for centuries as folk medicine. Modern research investigating the diversity of the chemical composition and plant sources, biological activity, extraction processes, analytical methods, and therapeutic properties in clinical settings have been carried out extensively since the 1980s. Due to its antimicrobial, anti-inflammatory, and immuno-modulator properties, propolis appears to be a suitable bioactive component to be incorporated into biomaterials. This review article attempts to analyze the potential application of propolis as a biomaterial component from the available experimental evidence. The efficacy and compabitility of propolis depend upon factors, such as types of extracts and types of biomaterials. Generally, propolis appears to be compatible with hydroxyapatite/calcium phosphate-based biomaterials. Propolis enhances the antimicrobial properties of the resulting composite materials while improving the physicochemical properties. Furthermore, propolis is also compatible with wound/skin dressing biomaterials. Propolis improves the wound healing properties of the biomaterials with no negative effects on the physicochemical properties of the composite biomaterials. However, the effect of propolis on the glass-based biomaterials cannot be generalized. Depending on the concentration, types of extract, and geographical sources of the propolis, the effect on the glass biomaterials can either be an improvement or detrimental in terms of mechanical properties such as compressive strength and shear bond strength. In conclusion, two of the more consistent impacts of propolis across these different types of biomaterials are the enhancement of the antimicrobial and the immune-modulator/anti-inflammatory properties resulting from the combination of propolis and the biomaterials.","",""
0,"Xian-Chun Zhong, Ya-Meng Liu, Xiao-Xia Gao, Kristopher W Krausz, Bing Niu, Frank J Gonzalez, Cen Xie","Caffeic acid phenethyl ester suppresses intestinal FXR signaling and ameliorates nonalcoholic fatty liver disease by inhibiting bacterial bile salt hydrolase activity",2023,"Acta pharmacologica Sinica","","","",75,"2026-01-24 10:13:04","Journal Article","10.1038/s41401-022-00921-7","1745-7254",,44,1,145,156,0,0.00,0,7,3,"Propolis is commonly used in traditional Chinese medicine. Studies have demonstrated the therapeutic effects of propolis extracts and its major bioactive compound caffeic acid phenethyl ester (CAPE) on obesity and diabetes. Herein, CAPE was found to have pharmacological activity against nonalcoholic fatty liver disease (NAFLD) in diet-induced obese mice. CAPE, previously reported as an inhibitor of bacterial bile salt hydrolase (BSH), inhibited BSH enzymatic activity in the gut microbiota when administered to mice. Upon BSH inhibition by CAPE, levels of tauro-β-muricholic acid were increased in the intestine and selectively suppressed intestinal farnesoid X receptor (FXR) signaling. This resulted in lowering of the ceramides in the intestine that resulted from increased diet-induced obesity. Elevated intestinal ceramides are transported to the liver where they promoted fat production. Lowering FXR signaling was also accompanied by increased GLP-1 secretion. In support of this pathway, the therapeutic effects of CAPE on NAFLD were absent in intestinal FXR-deficient mice, and supplementation of mice with C16-ceramide significantly exacerbated hepatic steatosis. Treatment of mice with an antibiotic cocktail to deplete BSH-producing bacteria also abrogated the therapeutic activity of CAPE against NAFLD. These findings demonstrate that CAPE ameliorates obesity-related steatosis at least partly through the gut microbiota-bile acid-FXR pathway via inhibiting bacterial BSH activity and suggests that propolis enriched with CAPE might serve as a promising therapeutic agent for the treatment of NAFLD.","",""
0,"Mariana Chelu, Jose Calderon Moreno, Irina Atkinson, Jeanina Pandele Cusu, Adriana Rusu, Veronica Bratan, Ludmila Aricov, Mihai Anastasescu, Ana-Maria Seciu-Grama, Adina Magdalena Musuc","Green synthesis of bioinspired chitosan-ZnO-based polysaccharide gums hydrogels with propolis extract as novel functional natural biomaterials",2022,"International journal of biological macromolecules","","","",76,"2026-01-24 10:13:04","Journal Article","10.1016/j.ijbiomac.2022.05.070","1879-0003",,211,,410,424,0,0.00,0,10,4,"A facile, green synthesis methodology to obtain zinc oxide nanoparticles using three polysaccharide gums (Acacia gum, Guar gum and Xanthan gum) of biological origin was developed. Subsequently, biosynthesized zinc oxide nanoparticles were incorporated into a sustainable chitosan hydrogel matrix functionalized with propolis extract. This study has revealed that the selected polysaccharides as chelates represents a suitable approach to synthesize ZnO nanoparticles of particular interest with controlled morphology. The formation of ZnO nanoparticles using polysaccharide gums was confirmed by FTIR, XRD, UV-Vis spectroscopy, thermal analysis, SEM, Raman and photoluminescence spectroscopies. The rheological behaviour of obtained hydrogels was evaluated. The AFM studies demonstrate that all synthesized chitosan incorporated ZnO composites hydrogels functionalized with propolis extract exhibit corrugated topographies. The present study highlights the possible incorporation of various guest molecules into hydrogel matrix due to its tuneable morphologies. The obtained hydrogel composites were cytocompatible in L929 fibroblast cell culture, in a range of concentrations between 50 and 1000 μg/mL, as assessed by MTT, LDH and Live/Dead double staining assays. By enhancing the biological properties, these novel green hydrogels show attractive superior performance in a wide concentration range to develop future in vivo suitable natural platforms as effective delivery systems of pharmacologic agents for biomedical applications.","",""
0,"Nuno Saraiva, Marisa Nicolai, Marta Martins, Nuno Almeida, Matteo Gusmini, Elisabete Muchagato Maurício, Maria Paula Duarte, Margarida Gonçalves, André Rolim Baby, Ana Fernandes, Catarina Rosado","Impact of Portuguese propolis on keratinocyte proliferation, migration and ROS protection: Significance for applications in skin products",2022,"International journal of cosmetic science","","","",77,"2026-01-24 10:13:04","Journal Article","10.1111/ics.12781","1468-2494",,44,3,333,342,0,0.00,0,11,4,"Propolis has been used since antiquity, but recent reports of its biological properties hint that it could be employed as a topical pharmaceutical and cosmetic ingredient. This work aims to probe the action of Portuguese propolis extracts on skin cells, providing mechanistic insights into its mode of action and preliminarily assessing its applicability as a skin repair ingredient. The total phenolic content of propolis extracts was measured by the Folin Ciocalteu method. The cytotoxic effect of propolis extracts in human keratinocytes was determined and non-cytotoxic concentrations of the extracts were used to study the impact on collective cell migration, cell cycle and intracellular ROS levels. o significant impact was observed in collective cell migration, but one of the extracts mildly increased G2 phase while reducing the % of sub-G1 at a non-cytotoxic concentration. The two extracts with higher phenolic content strongly prevented intracellular cellular ROS accumulation upon exposure to TBHP. Collectively, these results indicate that the putative beneficial effects of propolis extracts in skin repair may not be attributable to induction of collective cell migration but could be partially ascribed to the protection from oxidative stress, which could act in synergy with its well-known antimicrobial activity. These data support the applicability of this material in topical and cosmetic formulations and further in vivo assays should be conducted to fully characterize its efficacy and safety.","",""
0,"Piotr Paweł Wieczorek, Nataliia Hudz, Oksana Yezerska, Vladimira Horčinová-Sedláčková, Mariia Shanaida, Oleksii Korytniuk, Iza Jasicka-Misiak","Chemical Variability and Pharmacological Potential of Propolis as a Source for the Development of New Pharmaceutical Products",2022,"Molecules (Basel, Switzerland)","","","",78,"2026-01-24 10:13:04","Journal Article","10.3390/molecules27051600","1420-3049",,27,5,,,0,0.00,0,7,4,"This review aims to analyze propolis as a potential raw material for the development and manufacture of new health-promoting products. Many scientific publications were retrieved from the Scopus, PubMed, and Google Scholar databases via searching the word ""propolis"". The different extraction procedures, key biologically active compounds, biological properties, and therapeutic potential of propolis were analyzed. It was concluded that propolis possesses a variety of biological properties because of a very complex chemical composition that mainly depends on the plant species visited by bees and species of bees. Numerous studies found versatile pharmacological activities of propolis: antimicrobial, antifungal, antiviral, antioxidant, anticancer, anti-inflammatory, immunomodulatory, etc. In this review, the composition and biological activities of propolis are presented from a point of view of the origin and standardization of propolis for the purpose of the development of new pharmaceutical products on its base. It was revealed that some types of propolis, especially European propolis, contain flavonoids and phenolic acids, which could be markers for the standardization and quality evaluation of propolis and its preparations. One more focus of this paper was the overview of microorganisms' sensitivity to propolis for further development of antimicrobial and antioxidant products for the treatment of various infectious diseases with an emphasis on the illnesses of the oral cavity. It was established that the antimicrobial activity of different types of propolis is quite significant, especially to Gram-negative bacteria and lipophilic viruses. The present study could be also of interest to the pharmaceutical industry as a review for the appropriate design of standardized propolis preparations such as mouthwashes, toothpastes, oral drops, sprays, creams, ointments, suppositories, tablets, and capsules, etc. Moreover, propolis could be regarded as a source for the isolation of biologically active substances. Furthermore, this review can facilitate partially overcoming the problem of the standardization of propolis preparations, which is a principal obstacle to the broader use of propolis in the pharmaceutical industry. Finally, this study could be of interest in the area of the food industry for the development of nutritionally well-balanced products. The results of this review indicate that propolis deserves to be better studied for its promising therapeutic effects from the point of view of the connection of its chemical composition with the locality of its collection, vegetation, appropriate extraction methods, and standardization.","",""
0,"Navaneethan Radhakrishnan, Jaspreet Kaur Dhanjal, Anissa Nofita Sari, Yoshiyuki Ishida, Keiji Terao, Sunil C Kaul, Durai Sundar, Renu Wadhwa","Caffeic acid phenethyl ester (CAPE) confers wild type p53 function in p53Y220C mutant: bioinformatics and experimental evidence",2021,"Discover oncology","","","",79,"2026-01-24 10:13:04","Journal Article","10.1007/s12672-021-00461-2","2730-6011",,12,1,64,,0,0.00,0,8,5,"Mutations in the tumor suppressor protein p53 is a prevalent feature in majority of cancers resulting in inactivation of its activities related to control of cell cycle progression and proliferation. p53Y220C is one of the common hotspot mutations that causes decrease in its thermodynamic stability. Some small molecules have been shown to bind to the mutated site and restore its wild type thermodynamics and tumor suppressor function. In this study, we have explored the potential of caffeic acid phenethyl ester (CAPE-a bioactive compound from propolis) to interact with p53Y220C and restore its wild type p53 (p53wt) transcription activation and tumor suppressor activities. We recruited computational methods, viz. molecular docking, molecular dynamics simulations and free energy calculations to study the interaction of CAPE at the mutation crevice and found that it has potential to restore p53wt function of the p53Y220C mutant similar to a previously described restoration molecule PK7242. We provide cell-based experimental evidence to these predictions and suggest CAPE as a potential natural drug for treatment of p53Y220C mutant harboring cancers.","",""
0,"Victor P Ribeiro, Gari V Ccana-Ccapatinta, Jennyfer A Aldana-Mejía, Andresa A Berretta, Luiz Ab Moraes, Jairo K Bastos","Chemical characterization of Brazilian propolis using automated direct thermal desorption-gas chromatography-mass spectrometry",2022,"Journal of the science of food and agriculture","","","",80,"2026-01-24 10:13:04","Journal Article","10.1002/jsfa.11788","1097-0010",,102,10,4345,4354,0,0.00,0,6,4,"Propolis, produced by honey bees, is used around the world, displaying several corroborated biological activities. Brazil is one of the leading producers of propolis, with a great diversity of types, each with a characteristically chemical fingerprint influenced by the flora of the local region. The secondary metabolite's composition of propolis strongly impacts its biological properties, and its chemical characterization is of great importance for its quality control. Several chromatographic techniques have been applied to characterize propolis, highlighting the extraction of its volatiles and its analysis through gas chromatography. Fourteen Brazilian propolis samples collected in four states, including brown, green and red propolis types, were chemically characterized using the automated direct thermal desorption-gas chromatography-mass spectrometry (DTD-GC-MS). Red propolis type was characterized by acyclic saturated hydrocarbons, fatty alcohols, terpenes, and phenylpropanoids as nonacosane, α-copaene, β-amyrin acetate, anethole, and 7-O-methylvestitol. Brown propolis presented hydrocarbons, monoterpenes, and sesquiterpenes, as α-pinene and α-bisabolol. Brazilian green propolis presented polycyclic aromatic hydrocarbons and sesquiterpenes, including 1-methyl-octahydroanthracene, 2,5-dimethyl-γ-oxo-benzenebutanoic acid, nerolidol, and spathulenol. Principal component analysis (PCA) was performed, allowing for clustering brown and red propolis types, indicating a divergence with the chemical composition of the green propolis samples. The hierarchical cluster analysis (HCA) allowed the chemical fingerprint of each propolis type to be differentiated. Red propolis was characterized by sesquiterpenes, pterocarpans, and isoflavans; brown propolis was characterized by hydrocarbons, aldehydes, and monoterpenes, while green propolis samples were characterized by the presence of polycyclic aromatic hydrocarbons, sesquiterpenes, and naphthalene derivatives. © 2022 Society of Chemical Industry.","",""
0,"Hesham R El-Seedi, Nehal Eid, Aida A Abd El-Wahed, Mostafa E Rateb, Hanan S Afifi, Ahmed F Algethami, Chao Zhao, Yahya Al Naggar, Sultan M Alsharif, Haroon Elrasheid Tahir, Baojun Xu, Kai Wang, Shaden A M Khalifa","Honey Bee Products: Preclinical and Clinical Studies of Their Anti-inflammatory and Immunomodulatory Properties",2021,"Frontiers in nutrition","","","",81,"2026-01-24 10:13:04","Journal Article","10.3389/fnut.2021.761267","2296-861X",,8,,761267,,0,0.00,0,13,5,"Inflammation is a defense process triggered when the body faces assaults from pathogens, toxic substances, microbial infections, or when tissue is damaged. Immune and inflammatory disorders are common pathogenic pathways that lead to the progress of various chronic diseases, such as cancer and diabetes. The overproduction of cytokines, such as interleukin (IL)-1β, IL-6, and tumor necrosis factor-α, is an essential parameter in the clinical diagnosis of auto-inflammatory diseases. In this review, the effects of bee products have on inflammatory and autoimmune diseases are discussed with respect to the current literature. The databases of Google Scholar, PubMed, Science Direct, Sci-Finder and clinical trials were screened using different combinations of the following terms: ""immunomodulatory"", ""anti-inflammatory"", ""bee products"", ""honey"", ""propolis"", ""royal jelly"", ""bee venom"", ""bee pollen"", ""bee bread"", ""preclinical trials"", ""clinical trials"", and ""safety"". Honey bee products, including propolis, royal jelly, honey, bee venom, and bee pollen, or their bioactive chemical constituents like polyphenols, demonstrate interesting therapeutic potential in the regulation of inflammatory mediator production as per the increase of TNF-α, IL-1β, IL-6, Il-2, and Il-7, and the decrease of reactive oxygen species (ROS) production. Additionally, improvement in the immune response via activation of B and T lymphocyte cells, both in in vitro, in vivo and in clinical studies was reported. Thus, the biological properties of bee products as anti-inflammatory, immune protective, antioxidant, anti-apoptotic, and antimicrobial agents have prompted further clinical investigation.","",""
0,"Jing Cui, Xueqin Duan, Liting Ke, Xingxue Pan, Jia Liu, Xiaoping Song, Wuren Ma, Weimin Zhang, Yingqiu Liu, Yunpeng Fan","Extraction, purification, structural character and biological properties of propolis flavonoids: A review",2022,"Fitoterapia","","","",82,"2026-01-24 10:13:04","Journal Article","10.1016/j.fitote.2021.105106","1873-6971",,157,,105106,,0,0.00,0,10,4,"Propolis is an aromatic substance which is collected by bees and mixed with bee saliva. The plant sources of propolis are mainly consisted with plant exudates from bark, buds and etc. Flavonoids are secondary metabolites widely found in natural plants, which have a variety of health care functions and are the main active ingredients of propolis. This article summarized the types, active ingredients, pharmacological effects, extraction methods and applications of propolis flavonoids, the aim was to provide the theoretical basis for further research and development of propolis flavonoids.","",""
0,"Sharifah Nur Amalina Syed Salleh, Nur Ayuni Mohd Hanapiah, Wan Lutfi Wan Johari, Hafandi Ahmad, Nurul Huda Osman","Analysis of bioactive compounds and chemical composition of Malaysian stingless bee propolis water extracts",2021,"Saudi journal of biological sciences","","","",83,"2026-01-24 10:13:04","Journal Article","10.1016/j.sjbs.2021.07.049","1319-562X",,28,12,6705,6710,0,0.00,0,5,5,"Propolis is a resinous substance collected by stingless bees containing bioactive compounds which exert various biological properties. The present study focused on the evaluation of chemical profiles produced by three Indo-Malayan stingless bee propolis extracted using water. Fresh propolis was collected from the same area and ecosystem conditions in Selangor, Malaysia, namely Tetrigona apicalis, Tetrigona binghami, and Heterotrigona fimbriata. The bioactive compounds and chemical composition of propolis extracts were then analyzed using gas chromatography-mass spectrometry (GC-MS). Results showed that propolis from the three different stingless bee species consisted of major groups such as sugar (31.4%), carboxylic acid (17.1%), terpenoid (14.3%), sugar alcohol (11.4%), hydrocarbon (5.7%), aldehyde (5.7%) amino acid (2.9%) and other constituents (11.4%). Heterotrigona fimbriata displayed the highest amount for both total phenolics (13.21 mg/mL) and flavonoids (34.53 mg/mL) compared to other propolis extracts. There is also no significant difference detected between all samples since p ≤ 0.05. In conclusion, this study shows that Malaysian stingless bee propolis contain bioactive components that have great potential to be used for their therapeutic and medicinal benefits. However, more investigations and analysis of stingless bee propolis need to be carried out in order to enhance the understanding and applications of propolis in the future.","",""
0,"Núbia Sabrina Martins, Thais Fernanda de Campos Fraga-Silva, Giseli Furlan Correa, Mèdéton Mahoussi Michaël Boko, Leandra Naira Zambelli Ramalho, Débora Munhoz Rodrigues, Juliana Issa Hori, Diego Luis Costa, Jairo Kenupp Bastos, Vânia Luiza Deperon Bonato","Artepillin C Reduces Allergic Airway Inflammation by Induction of Monocytic Myeloid-Derived Suppressor Cells",2021,"Pharmaceutics","","","",84,"2026-01-24 10:13:04","Journal Article","10.3390/pharmaceutics13111763","1999-4923",,13,11,,,0,0.00,0,10,5,"Propolis is a natural product produced by bees that is primarily used in complementary and alternative medicine and has anti-inflammatory, antibacterial, antiviral, and antitumoral biological properties. Some studies have reported the beneficial effects of propolis in models of allergic asthma. In a previous study, our group showed that green propolis treatment reduced airway inflammation and mucus secretion in an ovalbumin (OVA)-induced asthma model and resulted in increased regulatory T cells (Treg) and polymorphonuclear myeloid-derived suppressor cells (PMN-MDSC) frequencies in the lungs, two leukocyte populations that have immunosuppressive functions. In this study, we evaluated the anti-inflammatory effects of artepillin C (ArtC), the major compound of green propolis, in the context of allergic airway inflammation. Our results show that ArtC induces in vitro differentiation of Treg cells and monocytic MDSC (M-MDSC). Furthermore, in an OVA-induced asthma model, ArtC treatment reduced pulmonary inflammation, eosinophil influx to the airways, mucus and IL-5 secretion along with increased frequency of M-MDSC, but not Treg cells, in the lungs. Using an adoptive transfer model, we confirmed that the effect of ArtC in the reduction in airway inflammation was dependent on M-MDSC. Altogether, our data show that ArtC exhibits an anti-inflammatory effect and might be an adjuvant therapy for allergic asthma.","",""
