Cites,Authors,Title,Year,Source,Publisher,ArticleURL,CitesURL,GSRank,QueryDate,Type,DOI,ISSN,CitationURL,Volume,Issue,StartPage,EndPage,ECC,CitesPerYear,CitesPerAuthor,AuthorCount,Age,Abstract,FullTextURL,RelatedURL
0,"Marta Vallecillo-Rivas, Manuel Toledano-Osorio, Cristina Vallecillo, Manuel Toledano, Raquel Osorio","The Collagen Origin Influences the Degradation Kinetics of Guided Bone Regeneration Membranes",2021,"Polymers","","","",283,"2026-01-24 10:27:37","Journal Article","10.3390/polym13173007","2073-4360",,13,17,,,0,0.00,0,5,5,"Collagen membranes are currently the most widely used membranes for guided bone regeneration; however, their rapid degradation kinetics means that the barrier function may not remain for enough time to permit tissue regeneration to happen. The origin of collagen may have an important effect on the resistance to degradation. The aim of this study was to investigate the biodegradation pattern of five collagen membranes from different origins: Biocollagen, Heart, Evolution X-fine, CopiOs and Parasorb Resodont. Membranes samples were submitted to different degradation tests: (1) hydrolytic degradation in phosphate buffer saline solution, (2) bacterial collagenase from Clostridium histolyticum solution, and (3) enzyme resistance using a 0.25% porcine trypsin solution. Immersion periods from 1 up to 50 days were performed. At each time point, thickness and weight measurements were performed with a digital caliper and an analytic microbalance, respectively. ANOVA and Student-Newman-Keuls tests were used for comparisons (p < 0.05). Differences between time-points within the same membranes and solutions were assessed by pair-wise comparisons (p < 0.001). The Evolution X-fine collagen membrane from porcine pericardium attained the highest resistance to all of the degradation tests. Biocollagen and Parasorb Resodont, both from equine origin, experienced the greatest degradation when immersed in PBS, trypsin and C. histolyticum during challenge tests. The bacterial collagenase solution was shown to be the most aggressive testing method.","",""
0,"Farid Bahrizadeh, Hamidreza Azimi Lisar, Noushin Jalayer Naderi","A survey on osteogenic effect of collagen-membrane derived from Rutilus kutum swim bladder in rat calvaria",2021,"Dental research journal","","","",284,"2026-01-24 10:27:37","Journal Article","","1735-3327",,18,,55,,0,0.00,0,3,5,"The collagen membrane which obtained from bovine pericardium and human skin in Guided Bone Regeneration (GBR) is costly and may even cause transmission of diseases. Replacing conventional collagen membranes with a more easily accessible and cheaper ones will have economic benefits. The aim was to determine the osteogenic effect of collagen-membrane derived from Rutilus kutum swim bladder on rat calvaria. The study was experimental. Thirty-six male albino rats of the Wistar strain were included in the study. The 5 mm surgical defects were created on calvarias and filled with allograft bone material and covered by R. kutum swim bladder (Group I), bovine derived pericardial membrane (Group II) and without membrane cover (Group III).The specimen were euthanized after 3, 5 and 8 weeks. The surrounding connective tissue was evaluated in term of osseous formation. Kruskal-Wallis, Univariant analysis of variance, and post hoc tests were used for statistical analysis. The P < 0.05 was considered statistically significant. A significant differences between groups in terms of osseous formation (P = 0.001) was noted. The difference of osseous formation was significantly higher in 5 and 8 weeks than 3 weeks after operation in all groups (P = 0.03 and P = 0.006, respectively). The osseous formation in Group I and II were significantly higher than Group III (P = 0.023 and P = 0.001). The R. kutum swim bladder had osteogenic effect on rat calvaria. R. kutum swim bladder can be a new source in natural derived collagen membrane in GBR.","",""
0,"Mitsuaki Furuhata, Tadahiro Takayama, Takanobu Yamamoto, Yasumasa Ozawa, Motoki Senoo, Manami Ozaki, Seiichi Yamano, Shuichi Sato","Real-time assessment of guided bone regeneration in critical size mandibular bone defects in rats using collagen membranes with adjunct fibroblast growth factor-2",2021,"Journal of dental sciences","","","",285,"2026-01-24 10:27:37","Journal Article","10.1016/j.jds.2021.03.008","2213-8862",,16,4,1170,1181,0,0.00,0,8,5,"Fibroblast growth factor-2 (FGF-2) regulates bone formation. The concept of guided bone regeneration using a resorbable collagen membrane (RCM) is generally accepted in implant dentistry. This study aimed to investigate the bone healing pattern in rat mandibular bone defects in real-time with and without RCM containing FGF-2 (RCM/FGF-2). Critical-size circular bone defects (4.0 mm diameter) were created on both sides of the rat mandibular bone. The defects were randomly divided into the following groups: control, RCM alone, RCM containing low (0.5 μg) or high (2.0 μg) concentration of FGF-2. We performed real-time in vivo micro-computerized tomography scans at the baseline and at 2, 4, and 6 weeks, and measured the volume of newly formed bone (NFB), bone mineral density (BMD) of NFB, and the closure percentage of the NFB area. At 6 weeks, the mandibular specimens were assessed histologically and histomorphometrically to evaluate the area of new bone regeneration. Real-time assessment revealed a significant increase in the volume, BMD, and closure percentage of the NFB area in the RCM/FGF-2-treated groups than that in the control and RCM groups. In the H-FGF-2 group, the volume and BMD of NFB exhibited a significant increase at 6 weeks than that at the baseline. Histological evaluation revealed the presence of osteoblasts, osteocytes, and blood vessels within the NFB. The real-time in vivo experiment demonstrated that RCM/FGF-2 effectively promoted bone regeneration within the critical-size mandibular defects in rats and verified new bone formation starting in the early postoperative phase.","",""
0,"M Fujioka-Kobayashi, S D Marjanowski, M Kono, S Hino, N Saulacic, B Schaller","Osteoinductive potential of recombinant BMP-9 in bone defects of mice treated with antiresorptive agents",2022,"International journal of oral and maxillofacial surgery","","","",286,"2026-01-24 10:27:37","Journal Article","10.1016/j.ijom.2021.08.014","1399-0020",,51,4,566,575,0,0.00,0,6,4,"The aim of the present study was to investigate the effects of recombinant human (rh)BMP-9 on bone regenerative potential in a mouse model of antibody-mediated antiresorptive therapy (AMART). A monoclonal anti-murine receptor activator of nuclear factor-kappa B ligand (RANKL) antibody (mAb) was used to create an AMART model in mice. rhBMP-9 combined with collagen membrane was implanted in calvarial defects in mAb-treated mice. After 4 weeks, the bone formative potential in the defects was evaluated by micro-computed tomography and histological approaches. The groups implanted with rhBMP-9-containing collagen membranes demonstrated substantial osteopromotive potential, with significantly greater new bone volume (Sham + BMP-9 group; 0.86 ± 0.29 mm3 and mAb + BMP-9 group; 0.64 ± 0.16 mm3) than control PBS-membranes (Sham + PBS group; 0.44 ± 0.29 mm3 and mAb + PBS group; 0.24 ± 0.12 mm3) in both sham and mAb-treated mice. In line with in vivo study, bone marrow cells isolated from both sham and mAb-treated mice confirmed greater osteogenic potential upon stimulation with rhBMP-9 in vitro. These findings suggest for the first time that local rhBMP-9 administration might be a strategy to accelerate bone regeneration in the context of AMART.","",""
0,"Yashika Bali, Ravpreet Singh, Tarunpreet Kaur Gill, Rathi Rela, Ritesh Vatsa, Priyanka Priyadarshni","Bone Graft and Intraosseous Anchorage of Dental Implants for Reconstruction of the Residual Alveolar Ridge",2021,"Journal of pharmacy & bioallied sciences","","","",287,"2026-01-24 10:27:37","Journal Article","10.4103/jpbs.JPBS_638_20","0976-4879",,13,,,,0,0.00,0,6,5,"Bone grafting aims at better dental implant osseointegration and preserves the remaining alveolar bone in the socket. The success of various bone grafting materials plays a vital role in assessing future implant function. The present clinical trial was aimed at evaluating the results of guided bone regeneration (GBR) with and without the bioresorbable membrane in the dental implant placement. The 20 patients were divided into two groups (n = 10). First was Group I- GBR with bioresorbable collagen membrane (BioGide™) and second was Group II- GBR without membrane. Bone gain and bone levels were analyzed for both groups. All the collected data were analyzed statistically. For Group I, bone levels at baseline were nonsignificant (P = 0.2188) Similarly, nonsignificant values were seen in both groups at 3 months with bone level values of 0.25 ± 0.17 and 0.38 ± 0.24 for Group I and Group II, respectively. Changes in the bone levels were found to be 2.45 ± 0.349 and 2.58 ± 0.304 from Group I and II, respectively, inferring the nonsignificant difference with P value of 0.3723. The percentage of bone gain for intergroup at the end of 3 months was 89.15% ±0.678 for Group I and 88.68% ± 0.503%; these values were statistically nonsignificant (P = 0.982). Nonsignificant difference was observed between the two groups with and without membrane in terms of changes in bone level, percentage of bone gain, and bone defect reduction. This study concludes that the use of bone grafts significantly improves residual alveolar ridge irrespective of membrane used.","",""
0,"Vikas Vaibhav, Abhishek Sinha, Deepika Bolisetty, Abhishek Verma, Kunal Kumar, Sanjeev Singh","Osseointegration of Dental Implants in Ridges with Insufficient Bones using Different Membranes for Guided Bone Regeneration",2021,"Journal of pharmacy & bioallied sciences","","","",288,"2026-01-24 10:27:37","Journal Article","10.4103/jpbs.JPBS_696_20","0976-4879",,13,,,,0,0.00,0,6,5,"The use of membrane with the guided bone regeneration (GBR) has been a controversial aspect of the implant placement, which helps achieve the primary graft stabilization and inhibit early graft loss. The present clinical trial was aimed to determine the results of GBR with nonresorbable (expanded polytetrafluoroethylene [e-PTFE]) and resorbable (collagen) membrane both clinically and radiographically for 2 years with dental implant placement. 16 subjects having 32 sites for implant placement in a split-mouth pattern were included in the study. The sites for implant was prepared and grafted with the autogenous graft procured from the mandibular ramus area followed by graft coverage with either e-PTFE or collagen membrane. Various radiographic and clinical parameters were assessed for 2 years at an interval of 6 months each. The collected data were recorded for each study subject for all the implant sites and were statistically analyzed. The mean values for periodontal probing depth at 6 months, 12 months, 18 months, and 24 months were 2.25 ± 0.17, 2.67 ± 1.84, 2.64 ± 1.21, and 3.01 ± 0.52, respectively, for the e-PTFE group. For the collagen group, the probing depth mean values at 6 months, 12 months, 18 months, and 24 months were 2.30 ± 0.14, 2.59 ± 1.76, 2.62 ± 1.30, and 2.98 ± 0.81, respectively. The corresponding clinical and radiographic parameters at all time intervals were nonsignificant on the intergroup comparison. Dental implants placed with simultaneous GBR have an acceptable survival rate at the end of 2 years irrespective of the resorbable or non-resorbable membrane used.","",""
0,"Sneha Gupta, Arun Kumar Teotia, Irfan Qayoom, Parvaiz Ahmad Shiekh, Syed Muntazir Andrabi, Ashok Kumar","Periosteum-Mimicking Tissue-Engineered Composite for Treating Periosteum Damage in Critical-Sized Bone Defects",2021,"Biomacromolecules","","","",292,"2026-01-24 10:27:37","Journal Article","10.1021/acs.biomac.1c00319","1526-4602",,22,8,3237,3250,0,0.00,0,6,5,"The periosteum is an indispensable part of the bone that nourishes the cortical bone and acts as a repertoire of osteoprogenitor cells. Periosteal damage as a result of traumatic injuries, infections, or surgical assistance in bone surgeries is often associated with a high incidence of delayed bone healing (union or nonunion) compounded with severe pain and a risk of a secondary fracture. Developing bioengineered functional periosteal substitutes is an indispensable approach to augment bone healing. In this study, we have developed a biomimetic periosteum membrane consisting of electrospun oxygen-releasing antioxidant polyurethane on collagen membrane (polyurethane-ascorbic acid-calcium peroxide containing fibers on collagen (PUAOCC)). Further, to assist bone formation, we have developed a bioactive inorganic-organic composite cryogel (bioglass-collagen-gelatin-nanohydroxyapatite (BCGH)) as a bone substitute. In an in vitro simulated oxidative stress model, PUAOCC supported the primary periosteal cell survival. Moreover, in an in vivo, critical-sized (5.9 mm × 3.2 mm × 1.50 mm) unicortical rat tibial bone defect, implantation of PUAOCC along with the functionalized BCGH led to significant improvement in bone formation along with periosteal regeneration. The periosteal regeneration was confirmed by expression of periosteum-specific periostin and neuronal regulation-related protein markers. Our study demonstrates the development of a periosteum-mimicking membrane with promising applications to facilitate periosteal regeneration, thus assisting bone formation when used in combination with bone composites and mimicking the natural bone repair process.","",""
0,"Xuzheng Liu, Wanli Chen, Bo Shao, Xinchi Zhang, Yinggang Wang, Siqian Zhang, Wei Wu","Mussel patterned with 4D biodegrading elastomer durably recruits regenerative macrophages to promote regeneration of craniofacial bone",2021,"Biomaterials","","","",294,"2026-01-24 10:27:37","Journal Article","10.1016/j.biomaterials.2021.120998","1878-5905",,276,,120998,,0,0.00,0,7,5,"Crosstalk between bone marrow mesenchymal stem cells (BMSCs) and macrophages plays vital role in bone healing. By investigating the mechanism of collagen membrane-guided bone regeneration, we found compact structure and rapid membrane degradation compromised the duration of M2 macrophages influx, which restricts the recruitment of BMSCs that is essential for bone healing. To tackle this issue, a biodegrading elastomeric compound consisting of poly(glycerol sebacate) (PGS) and polycaprolactone (PCL) was fabricated into hierarchically porous membrane. The rational design of 3D microstructure enabled sufficient polydopamine (PDA) coating. Without any addition of growth factors, the 3D-patterned PDA membrane enables early and durable influx of M2 macrophages, which in turn promotes BMSCs recruitment and osteogenic differentiation. Furthermore, 4D-morphing of the membrane fully regenerates the dome shaped calvarial bone as well as arc-shape bone in peri-implant alveolar defect without filling xenogenous substitute. This study revealed the superiority of 3D printed microstructures in immunomodulatory materials. The availability of 4D-morphing for PGS/PCL construct expanded their advantages in reconstructing craniofacial bone.","",""
0,"Young Woo Song, Hyun-Jun Jung, Yin-Zhe An, Ui-Won Jung, Jung-Seok Lee","Addition of autogenous bone chips to deproteinized bovine bone mineral does not have additional benefit in lateral ridge augmentation-A preclinical in vivo experimental study",2021,"Clinical oral implants research","","","",295,"2026-01-24 10:27:37","Journal Article","10.1111/clr.13805","1600-0501",,32,9,1105,1114,0,0.00,0,5,5,"To compare the outcome after extensive lateral guided bone regeneration using deproteinized bovine bone mineral (DBBM) with or without autogenous bone chips in a canine model of chronic horizontal alveolar ridge defect. The second, third and fourth lower premolars of both sides were extracted, and the buccal bone walls were completely removed in five beagle dogs. After 4 weeks, DBBM particles mixed with autogenous bone chips at a ratio of 1:1 were grafted at one side (DBBM/Auto group), while DBBM particles alone were grafted at the contralateral side (DBBM group). The graft materials on both sides were covered by a resorbable collagen membrane and fixation pins. Microcomputed tomographic volume and histomorphometric analyses were performed at 16 weeks post-surgery. The ridges of both groups were recovered horizontally, but new bone formation beyond the original ridge contour at the defect site was not found. The DBBM group exhibited a larger total radiographic augmented volume and new bone volume compared with the DBBM/Auto group, but the differences were minimal (p > .05). Histologically, the regenerated area and new bone area were also slightly larger without any statistical significance in the DBBM group than in the DBBM/Auto group (p > .05). The addition of autogenous bone chips to DBBM for lateral ridge augmentation may confer no advantage over grafting DBBM alone with respect to both space maintenance and de novo bone formation in dogs.","",""
0,"Lara Schorn, Tim Fienitz, Kathrin Berndsen, Norbert R Kübler, Henrik Holtmann, Daniel Rothamel","The use of solvent-preserved human and bovine cancellous bone blocks for lateral defect augmentation - an experimental controlled study in vivo",2021,"Head & face medicine","","","",296,"2026-01-24 10:27:37","Journal Article","10.1186/s13005-021-00275-1","1746-160X",,17,1,21,,0,0.00,0,6,5,"The aim of this study was to compare new bone formation, resorbed bone matrix, and fibrous enclosed residual bone substitute material in laterally augmented alveolar bone defects using allogeneic, pre-treated and cleaned human bone blocks (tested in dogs, therefore considered to be xenogeneic), and pre-treated and cleaned bovine cancellous bone blocks, both with and without a collagen membrane in order to evaluate their augmentative potential. Thirty-two critical size horizontal defects were prepared in the mandible of 4 adult foxhound dogs (8 per dog, 4 on each side). After 3 months of healing, the defects were laterally augmented in a split-mouth-design with either human (HXB) or bovine solvent-preserved bone blocks (BXB). Afterwards, defects were randomly covered with a bovine collagenous membrane (HXB + M, BXB + M). After a healing interval of 6 months, percentages of new bone formation, resorbed bone matrix, and fibrous enclosed residual bone substitute material were compared. Results showed little new bone formation of up to 3.7 % in human bone blocks (HXB 3.7 % ± 10.2, HXB + M 0.3 %± 0.4, BXB, 0.1 % ± 0.8, BXB + M 2.6 % ± 3.2, p = > 0.05). Percentages of fibrous encapsulation were higher in human bone blocks than in bovine bone blocks (HXB 71.2 % ± 8.6, HXB + M 73.71 % ± 10.6, BXB, 60.5 % ± 27.4, BXB + M 52.5 % ± 28.4, p = > 0.05). Resorption rates differed from 44.8 % in bovine bone blocks covered with a membrane to 17.4 % in human bone blocks (HXB 17.4 % ± 7.4, HXB + M 25.9 % ± 10.7, BXB, 38.4 % ± 27.2, BXB + M 44.8 % ± 29.6, p = > 0.05). The use of additional membranes did not significantly affect results. Within its limitations, results of this study suggest that solvent-preserved xenogenic human and bovine bone blocks are not suitable for lateral bone augmentation in dogs. Furthermore, defect coverage with a membrane does not positively affect the outcome.","",""
0,"Prisana Pripatnanont, Chanokpim Chankum, Jirut Meesane, Jutakan Thonglam","Physical and biological performances of a semi-resorbable barrier membrane based on silk fibroin-glycerol-fish collagen material for guided bone regeneration",2021,"Journal of biomaterials applications","","","",297,"2026-01-24 10:27:37","Journal Article","10.1177/08853282211025781","1530-8022",,36,5,930,942,0,0.00,0,4,5,"The fragility of silk fibroin film is a drawback to being used as a barrier membrane. Semi-resorbable barrier membranes maintain function longer than a resorbable membrane and no need to be removed. The study aimed to fabricate semi-resorbable membranes using silk fibroin with glycerol plasticizer (Group A), immobilized with fish collagen (Group B), and then characterized, in vitro biocompatibility tested, and compared with a commercial collagen membrane (Group C). Group B showed more roughness (0.2155 µm) than Group A (0.1424 µm). Group A was more hydrophilic (76.75° ± 3.07°) and more stiffness (28.93% ± 15.56%) than Group B (112.67° ± 1.94°, 42.10% ± 11.46%) and C (54.79% ± 13.44%) without significant difference. Group C had a significantly higher (p < 0.05) swelling degree and less degradation rate than others. Group A showed significantly highest (p < 0.05) cell proliferation. Group C showed more alkaline phosphatase activity than others but no significant difference in osteocalcin and Alizarin Red activity on day 21. The semi-resorbable membrane based on silk fibroin-glycerol possessed good physical and mechanical properties, and well-supported osteoblastic cell proliferation and differentiation.","",""
0,"Hsu Kuo Tien, Won-Ho Lee, Chang-Sung Kim, Seong-Ho Choi, Reinhard Gruber, Jung-Seok Lee","Alveolar ridge regeneration in two-wall-damaged extraction sockets of an in vivo experimental model",2021,"Clinical oral implants research","","","",298,"2026-01-24 10:27:37","Journal Article","10.1111/clr.13791","1600-0501",,32,8,971,979,0,0.00,0,6,5,"To determine the healing outcome following grafting with deproteinized porcine bone mineral (DPBM) with or without collagen membrane coverage in two-wall (both buccal and lingual)-damaged extraction sockets. Distal roots of three mandibular premolars in six beagle dogs were extracted, and the whole buccal and lingual bony walls were surgically removed. Three treatment protocols were then applied according to the following group allocation: no graft (None), grafting DPBM (BG), and grafting DPBM with coverage by a collagen membrane (BG + M). Two observational periods (2 and 8 weeks) were used with the split-mouth design, and quantitative and qualitative analyses were performed by microcomputed tomography and histology. The dimensions of the alveolar ridge at both grafted sites (BG and BG + M) remained similar to those of the pristine ridge in the histologic and radiographic analyses, whereas the ungrafted sites (None) collapsed both vertically and horizontally. Both grafting protocols produced substantial bony regeneration, but the addition of a covering membrane enhanced the proportion of mineralized tissue within the augmented area, and the BG + M group also showed a significantly larger area of regenerated ridge than the None group (p < .05). Bone grafting with collagen membrane can maintain the alveolar ridge dimensions with substantial bone regeneration in a two-wall-damaged extraction socket.","",""
0,"Balazs Feher, Karol Ali Apaza Alccayhuaman, Franz Josef Strauss, Jung-Seok Lee, Stefan Tangl, Ulrike Kuchler, Reinhard Gruber","Osteoconductive properties of upside-down bilayer collagen membranes in rat calvarial defects",2021,"International journal of implant dentistry","","","",299,"2026-01-24 10:27:37","Journal Article","10.1186/s40729-021-00333-y","2198-4034",,7,1,50,,0,0.00,0,7,5,"Bilayer collagen membranes are routinely used in guided bone/tissue regeneration to serve as osteoconductive scaffolds and prevent the invasion of soft tissues. It is recommended to place the membranes with their dense layer towards the soft tissue and their porous layer towards the bony defect area. However, evidence supporting this recommendation is lacking. This study aimed to determine whether the alignment of bilayer collagen membranes has an effect on bone regeneration. In two groups of ten male Sprague-Dawley rats each, a 5-mm calvarial defect was created. Thereafter, the defect was randomly covered with a bilayer, resorbable, pure type I and III collagen membrane placed either regularly or upside-down (i.e., dense layer towards bone defect). After 4 weeks of healing, micro-computed tomography (μCT), histology, and histomorphometry of the inner cylindrical region of interest (4.5 mm in diameter) were performed to assess new bone formation and the consolidation of the collagen membrane in the defect area. Quantitative μCT showed similar bone volume (median 8.0 mm3, interquartile range 7.0-10.0 vs. 6.2 mm3, 4.3-9.4, p = 0.06) and trabecular thickness (0.21 mm, 0.19-0.23 vs. 0.18 mm, 0.17-0.20, p = 0.03) between upside-down and regular placement, both leading to an almost complete bony coverage. Histomorphometry showed comparable new bone areas between the upside-down and regularly placed membranes, 3.9 mm2 (2.7-5.4) vs. 3.8 mm2 (2.2-4.0, p = 0.31), respectively. Both treatment groups revealed the same regeneration patterns and spatial distribution of bone with and without collagen fibers, as well as residual collagen fibers. Our data support the osteoconductive properties of collagen membranes and suggest that bone regeneration is facilitated regardless of membrane layer alignment.","",""
