Cites,Authors,Title,Year,Source,Publisher,ArticleURL,CitesURL,GSRank,QueryDate,Type,DOI,ISSN,CitationURL,Volume,Issue,StartPage,EndPage,ECC,CitesPerYear,CitesPerAuthor,AuthorCount,Age,Abstract,FullTextURL,RelatedURL
0,"Kanokporn Santavalimp, Jirut Meesane, Juthakarn Thonglam, Kawintip Prasongyuenyong, Prisana Pripatnanont","Fabrication and Characterization of Semi-Resorbable Bioactive Membrane Derived from Silk Fiber Sheet for Guided Bone Regeneration",2025,"Biomimetics (Basel, Switzerland)","","","",11,"2026-01-24 10:27:37","Journal Article","10.3390/biomimetics10110790","2313-7673",,10,11,,,0,0.00,0,5,1,"The barrier membrane is a key component in guided bone regeneration (GBR); however, there is no current commercially available membrane universally suitable for all clinical situations. The semi-resorbable bioactive barrier membrane derived from a silk fiber sheet (SF), polyvinyl alcohol (PVA), and biphasic calcium phosphate (BCP) was fabricated to provide improved physical, mechanical, and bioactive properties. There were four experimental groups: PVA/SF, 1BCP/PVA/SF, 3BCP/PVA/SF, and 5BCP/PVA/SF. All fabricated membranes appeared white in color with a smooth texture; however, SEM images revealed a rougher top surface compared to the bottom surface. FTIR and DSC validated the presence of the SF and PVA with or without BCP. All membranes displayed high hydrophilicity, except the PVA/SF group, which remained hydrophobic on the bottom surface. The water uptake of all groups reached the plateau phase within 10 min. The degradation rate fell within the range of 5-20% over a three-month period. Both fibroblastic and osteoblastic cells attached and survived on the BCP-incorporated membranes, comparable to those observed in the commercially available ossifying collagen membrane. Among the fabricated membranes, the 3BCP/PVA/SF formulation demonstrated the most favorable physical, mechanical, and biological properties for GBR applications.","",""
0,"Sinem Yeniyol, Gülfem Özlü Uçan","Short-term retrospective analysis of radiographic evaluation of graft height changes after maxillary sinus floor augmentation with xenograft and simultaneous dental implant placement: a two-dimensional radiographic study",2025,"BMC oral health","","","",12,"2026-01-24 10:27:37","Journal Article","10.1186/s12903-025-07356-6","1472-6831",,25,1,1920,,0,0.00,0,2,1,"Progressive sinus pneumatization, stable sinus graft height and shrinkage of the graft material after maxillary sinus augmentation represent limitations for clinical practice. Seventy-eight maxillary sinus floor augmentations and 83 dental implant positions were performed on 60 patients. The lateral window approach was used for maxillary sinus floor augmentation. A collagenated porcine bone xenograft (OsteoBiol® Gen-Os®, Tecnoss®, Giaveno, Italy) and a collagen membrane (OsteoBiol® Evolution, Tecnoss®, Giaveno, Italy) were used as grafting materials. Vertical bone gain was analyzed immediately after surgery (T1) and after 4 months (T2) via panoramic radiographic measurements with respect to residual bone height (T0), which was measured preoperatively. Graft height changes were evaluated with respect to implant location, diameter, length, brand and sinus graft width. The mean vertical bone gain per implant following simultaneous maxillary sinus augmentation at sites with a residual bone height of less than 4 mm (11.14 ± 1.87 mm) was the highest among all groups (p < 0.001) at the time of baseline surgery. The mean vertical bone gain at the grafted sinus height was significantly lower at 4 months (13.78 ± 1.24 mm) than at baseline (14.58 ± 1.31 mm) (p < 0.001). Four months after baseline surgery, a statistically significant decrease of 5.49% in the change in graft height was associated with graft contraction (p < 0.001). When the mean graft height changes were compared according to the implant location, diameter, length, brand and sinus graft width, no statistically significant differences were observed (p > 0.05). Within the limits of this retrospective study, collagenated porcine bone xenografts can be used successfully as a sinus augmentation material with simultaneous implant positioning and may contribute to improved graft shrinkage in the short term.","",""
0,"Ana Maira Pereira Baggio, Arthur Henrique Alécio Viotto, Izabela Fornazari Delamura, Vinicius Ferreira Bizelli, Ricardo Garcia Mureb Jacob, Ciro Borges Duailibe de Deus, Rodrigo Faria Neiva, Leonardo Perez Faverani, Ana Paula Farnezi Bassi","Comparative in vivo evaluation of cross-linked and non-cross-linked collagen membranes for guided bone regeneration in rat calvarial defects",2025,"Brazilian oral research","","","",13,"2026-01-24 10:27:37","Journal Article","10.1590/1807-3107bor-2025.vol39.110","1807-3107",,39,,,,0,0.00,0,9,1,"Guided bone regeneration (GBR) is a critical strategy for repairing large bone defects. This study aimed to assess the osteopromotive potential of a porcine cross-linked collagen membrane in critical calvaria-defects in rats. Seventy-two rats were divided into three groups: blood clot (CG - negative control), Bio-Gide® membrane (BG - positive control), and Ossix Plus® membrane (OSX - test). The defects were covered according to each group, and the experimental times were 7, 15, 30, and 60 days postoperatively. The collected samples were evaluated by histometric analysis, inflammatory profile, immunohistochemistry, and micro-computed tomography (micro-CT). At 7 days, no significant differences in bone neoformation were observed. At 15 days, the OSX group showed increased new bone formation compared to CG (p = 0.031). At 30 days, the BG group exhibited the most significant increase compared to both OSX (p < 0.001) and CG (p < 0.001). At 60 days, OSX demonstrated the highest osteopromotive potential, significantly outperforming CG (p < 0.001) and BG (p < 0.001). MicroCT analysis revealed that the OSX group had a bone volume (BV) of 17.33 ± 1.74 mm3, significantly higher than BG (8.06 ± 1.26 mm3, p < 0.05). The cross-linked collagen membrane was biologically more favorable for bone regeneration being a promising option for GBR procedures.","",""
0,"Stefan P Bienz, Philippe C Deggeller, Riccardo D Kraus, Marina Green Buzhor, Daniel S Thoma, Ronald E Jung","Evaluation of a Novel Bioresorbable Device for Guided Bone Regeneration: An In Vitro CBCT Study on Pig Jaws",2025,"International journal of dentistry","","","",14,"2026-01-24 10:27:37","Journal Article","10.1155/ijod/2617319","1687-8728",,2025,,2617319,,0,0.00,0,6,1,"To compare the volume stability of guided bone regeneration (GBR) on peri-implant bone dehiscence defects during flap closure using a novel bioresorbable device with a deproteinized bovine bone mineral (DBBM) or an L-shaped DBBM with 10% collagen (DBBM-C). A bioresorbable device was designed and printed using a medical-grade polyglycolide-colactide copolymer (PGLA). Twenty peri-implant box-shaped bone defects were created in 10 pig mandibles. GBR procedures were performed with: device (device + DBBM + collagen membrane) or L-shape (L-shaped DBBM-C + collagen membrane + fixation pins). Cone-beam computed tomography (CBCT) scans were carried out prior and after wound closure. The horizontal thickness of the augmentation at the buccal implant shoulder, procedure duration, and difficulty of each GBR procedure were recorded. No statistically significant differences for the horizontal thickness of the augmentation at the buccal implant shoulder were obtained (p=0.8652). For the device, the median measured 2.35 mm (first quartile [Q1]: 2.03; third quartile [Q3]: 2.68) and and for L-shape it was 3.05 mm (Q1:2.48; Q3:3.23). The amount of time for the procedure was statistically significantly lower with 149.5 s using the device (Q1:127.25; Q3:160.5) compared to 206.5 s (Q1:198.75; Q3:236.75) using L-shape (p=0.0039). Difficulty was statistically significantly lower for the device with 2 (Q1:1; Q3:3) compared to 5 (Q1:4; Q3:5.25) for L-shape (p=0.0020). GBR with the device in combination with DBBM and a collagen membrane led to a similar amount of horizontal thickness of the augmentation as an L-shaped DBBM-C with a collagen membrane and fixation pins. The procedure with the device was significantly faster and easier for the clinician.","",""
0,"Matthijs Hindryckx, Thomas De Bruyckere, Sonja Hitz-Steiger, Lorenz Seyssens, Retis Shtino, Faris Younes, Daniel Thoma, Jan Cosyn","A Multi-Center RCT Comparing Titanium-Reinforced dPTFE Membrane to Collagen Membrane in Horizontal Bone Augmentation at Single Sites in the Anterior Maxilla: Clinical and Histological Outcomes",2025,"Clinical implant dentistry and related research","","","",15,"2026-01-24 10:27:37","Journal Article","10.1111/cid.70097","1708-8208",,27,6,,,0,0.00,0,8,1,"To compare a dPTFE membrane to a collagen membrane in guided bone regeneration (GBR) for horizontal bone augmentation at single sites in the anterior maxilla in terms of alveolar width and bone quality, as clinically and histologically assessed. Patients with a class 4 defect (Benic and Hämmerle 2014) at a single site in the anterior maxilla (15-25) were recruited in five centers. Following flap elevation and conditioning of the recipient site, they were randomly allocated to the dPTFE membrane group or the collagen membrane group. All patients were treated with a 1:1 mixture of autogenous bone and DBBM. Nine months following bone augmentation, re-entry was performed, intra-surgical clinical measurements were registered, and core biopsies were obtained for histological analyses. Thirty-six patients were randomized (dPTFE membrane group: 8 females, 10 males, mean age 39; collagen membrane group: 14 females, 4 males, mean age 51) and all but one underwent re-entry. GBR was effective in both groups (p < 0.001) yet followed a different pattern over time (p = 0.010) with a higher postoperative alveolar width in the collagen membrane group followed by more graft resorption. At re-entry, the estimated marginal mean alveolar width was 7.0 mm in the dPTFE membrane group and 6.5 mm in the collagen membrane group at re-entry, without statistically significant differences between the groups (p = 0.326). However, infection occurred in 6/18 patients treated with a dPTFE membrane group versus in none treated with a collagen membrane. Clinical assessment at re-entry identified fibrous tissue at the buccal aspect in 7/18 (39%) patients treated with a dPTFE membrane and in 8/17 (47%) patients treated with a collagen membrane, without statistically significant differences between the groups (p = 0.738). Histomorphometric analyses showed newly formed bone in both groups (> 30%) and a minimal amount of DBBM particles (~5%), mostly being in intimate contact with surrounding newly formed bone (~70%). The non-mineralized tissue fraction was 5% higher in the dPTFE membrane group (p = 0.020). There were no significant differences between the groups for other histological outcome measures. Alveolar width enabled implant installation at 9 months in both groups, yet dPTFE membrane was prone to infection. In both groups, fibrous tissue at the buccal aspect was common and newly formed bone was consistently observed. ClinicalTrials.gov identifier: NCT05426616.","",""
0,"Carlotta Dionigi, Erik Regidor, Anna Trullenque-Eriksson, Jan Derks, Mariano Sanz, Alberto Ortiz-Vigón","The Use of a Resorbable Membrane as an Adjunct to a Xenogeneic Bone Replacement Graft in the Reconstructive Surgical Therapy of Peri-Implantitis: 3-Year Results of a Randomised Clinical Trial",2026,"Journal of clinical periodontology","","","",16,"2026-01-24 10:27:37","Journal Article","10.1111/jcpe.70057","1600-051X",,53,2,268,285,0,0.00,0,6,1,"To evaluate the effect of the adjunctive use of a resorbable collagen membrane in the reconstructive surgical therapy of peri-implantitis. Forty-three patients (43 implants) diagnosed with peri-implantitis underwent surgical treatment using a reconstructive approach, which included a bone substitute material with (test) or without (control) a resorbable collagen membrane. Supportive peri-implant treatment was administered biannually during the 3-year follow-up period. Clinical outcomes, such as probing pocket depth (PPD), bleeding on probing (BOP), suppuration on probing (SOP), marginal mucosal level (REC) and keratinised mucosa width (KM), were recorded at baseline, as well as at 6, 12 and 36 months. Radiographic marginal bone levels (MBLs) and patient-reported outcomes (PROs) were also evaluated. The primary outcome was a composite measure consisting of PPD ≤ 5 mm, absence of BOP/SOP and buccal REC of ≤ 1 mm. A second composite outcome, termed 'disease resolution', was also assessed, defined as PPD ≤ 5 mm, BOP at ≤ 1 site and complete absence of SOP. Out of the 43 participants, 8 were lost to follow-up, 2 experienced implant loss and 1 was surgically re-treated. At 3 years, the composite outcome was achieved for 25.0% of implants (test: 17.6%; control: 27.8%), while disease resolution was achieved for 31.2% (test: 29.4%; control: 27.8%). Overall, PPD and BOP were reduced by 3.6 ± 3.2 mm and 37.5% ± 42.1%, respectively. Changes in buccal REC and KM were 0.5 ± 1.3 and 1.1 ± 1.5 mm, respectively. An overall bone gain (MBL change) of 1.0 ± 2.2 mm was observed. PROs were favourable. No statistically significant differences were observed between groups. Adding a collagen membrane to a bone substitute material in the surgical treatment of peri-implantitis did not yield any benefits regarding clinical, radiographic or patient-reported outcomes. ISRCTN67095066 (https://www.isrctn.com/ISRCTN67095066).","",""
0,"Pier Paolo Poli, Luca Giboli, Mattia Manfredini, Shahnavaz Khijmatgar, Francisley Ávila Souza, Carlo Maiorana","Horizontal Bone Augmentation with Natural Collagen Porcine Pericardium Membranes: A Prospective Cohort Study",2025,"Medicina (Kaunas, Lithuania)","","","",17,"2026-01-24 10:27:37","Journal Article","10.3390/medicina61101814","1648-9144",,61,10,,,0,0.00,0,6,1,"Background and Objectives: Adequate buccal bone thickness is critical for long-term peri-implant health and stability. When residual alveolar bone volume is insufficient, guided bone regeneration (GBR) is a widely adopted technique. While non-resorbable membranes provide structural support, they carry a higher risk of complications and require secondary surgery. Resorbable collagen membranes, offer promising biological properties and easier clinical handling, yet clinical data remain limited. This prospective cohort study aimed to evaluate the clinical and radiographic outcomes of horizontal GBR using a native, non-cross-linked resorbable porcine pericardium membrane fixed with titanium pins, in conjunction with simultaneous implant placement. Materials and Methods: Eighteen patients (26 implants) with horizontal alveolar defects (<6 mm) underwent implant placement and GBR with deproteinized bovine bone mineral and a porcine pericardium collagen membrane. Horizontal bone gain and buccal bone thickness were measured at baseline and 6 months post-operatively. Post-operative complications, patient-reported outcomes (PROMs), and peri-implant tissue health were assessed up to 1 year post-loading. Results: Mean bone gain was 2.95 ± 0.95 mm, and all sites achieved a buccal bone thickness ≥ 1.5 mm. No membrane-related complications occurred. PROMs revealed low morbidity. At 1-year follow-up, marginal bone loss averaged 0.54 ± 0.7 mm, mean probing depth was 2.79 ± 0.78 mm, 92% of sites exhibited keratinized mucosa ≥ 2 mm. Conclusions: Native resorbable porcine pericardium membranes, when combined with DBBM and mechanical stabilization, seem to be effective for horizontal bone regeneration.","",""
0,"P K Rabha, Subhas Chandra Debnath, Anovili N Chishi, Priyangana Nath, A Dhanushya","Guided Bone Regeneration (GBR) Using a Collagen Membrane Barrier Technique Along With Full Thickness Buccal Mucoperiosteal Flap For the Preservation of the Alveolar Ridge Following Tooth Extraction",2025,"Journal of maxillofacial and oral surgery","","","",18,"2026-01-24 10:27:37","Journal Article","10.1007/s12663-024-02419-7","0972-8279",,24,5,1434,1440,0,0.00,0,5,1,"The preservation of the alveolar ridge following tooth extraction is important for maintaining optimal dental health and ensuring successful future dental interventions. Various techniques for alveolar ridge preservation are done, including socket grafting and the use of biomaterials, membranes, and growth factors, which have a plenty of clinical benefits, such as improved aesthetics and stability for dental implants along with potential cost-effectiveness compared to more invasive procedures, thus optimizing treatment outcomes and promoting long-term dental health. To assess the effectiveness of bone graft material and collagen membrane for ridge preservation following tooth extraction compared to tooth extraction alone group. Ninety patients presenting with the need for extraction were included in this study.They were divided into three groups. In group A, the socket was filled with bone allograft and protected with a fish derived collagen membrane without buccal thickness flap. In group B, buccal/labial thickness flap was elevated, socket was filled with bone allograft and protected with a fish derived collagen membrane barrier, and in group C, no bone graft and collagen membranes were placed. Showed that group A is much more beneficial and simpler than the group B procedures. Bone regeneration using collagen membranes and inorganic bovine bone combination seems promising. But, there is obviously a need for long-term studies to confirm the success rate of ridge preservation procedures using buccal full thickness flap and without buccal full thickness flap.","",""
0,"Anthony L Neely, Minkie Kim, Joseph Samona, Jung I Yoon, Bassam M Kinaia","Management of Retrograde Peri-Implantitis Using Guided Bone Regeneration",2025,"Compendium of continuing education in dentistry (Jamesburg, N.J. : 1995)","","","",19,"2026-01-24 10:27:37","Journal Article","","2158-1797",,46,7,322,325,0,0.00,0,5,1,"Retrograde peri-implantitis (RPI) is characterized by atypical and often progressive bone loss at the periapex of a dental implant. Although RPI reportedly has a lower prevalence than marginal peri-implantitis, if left untreated it can lead to loss of dental implants. In this clinical case series, two patients with different presentations of RPI were treated with guided bone regeneration (GBR) using bone graft and collagen membrane. Longterm follow-up showed clinical and radiographic improvements that resulted in radiographic bone fill and reduced probing depths around implants. Observations reported herein suggest that GBR in defects caused by RPI is an effective treatment option.","",""
0,"Shweta Bhagat, Priyanka Jaiswal, Pavan Bajaj, Sakshi Kotecha, Geeta Bhandari","Regenerative Evaluation of Collagen and an Advanced Platelet-rich Fibrin Membranes with Deproteinized Bovine Bone Matrix in Infrabony Defects: A Randomized Controlled Trial",2025,"The journal of contemporary dental practice","","","",20,"2026-01-24 10:27:37","Journal Article","10.5005/jp-journals-10024-3908","1526-3711",,26,6,573,580,0,0.00,0,5,1,"This study aimed to compare the effectiveness of bioresorbable collagen membrane and an advanced platelet-rich fibrin (A-PRF) membrane, both combined with deproteinized bovine bone matrix (DBBM) xenograft, in the treatment of human infrabony defects. Twenty-four patients (aged 28-54 years) with moderate to advanced periodontitis and infrabony defects were randomly assigned to two groups. Group A received open flap debridement with deproteinized DBBM xenograft and a bioresorbable collagen membrane, while group B received DBBM with A-PRF. Clinical parameters, including probing pocket depth (PPD), clinical attachment level (CAL), gingival recession, radiographic bone fill, and oral hygiene status, were assessed at baseline and 6 months postoperatively. At the 6-month follow-up after regenerative procedures, both treatment groups showed improvements in clinical parameters and radiographic bone gain. At 6 months, no significant difference in CAL gain was found between group A (3.5 ± 0.79 mm) and group B (3.66 ± 0.88 mm), with a mean difference of 0.16 ± 1.26 mm (p > 0.05). Additionally, the radiographic bone fill (%BF) in the DBBM + collagen membrane group was comparable to that in the DBBM + A-PRF membrane group, with no statistically significant difference. Within the limitations of this study, the combination of DBBM and a collagen membrane (group A) resulted in significantly more favorable clinical outcomes in terms of radiographic bone fill for infrabony defects as compared to group B. Both collagen and A-PRF membranes with DBBM significantly improved clinical and radiographic outcomes in treating infrabony defects. Advanced platelet-rich fibrin offers a promising autologous alternative to collagen, supporting effective periodontal regeneration without animal-derived barriers. How to cite this article: Bhagat S, Jaiswal P, Bajaj P, et al. Regenerative Evaluation of Collagen and an Advanced Platelet-rich Fibrin Membranes with Deproteinized Bovine Bone Matrix in Infrabony Defects: A Randomized Controlled Trial. J Contemp Dent Pract 2025;26(6):573-580.","",""
0,"Yiqin Wang, Junliang Wen, Xinhang Yu, Jun Chen, Wenjie Li","[Application progress of collagen membranes in oral medicine]",2025,"Zhong nan da xue xue bao. Yi xue ban = Journal of Central South University. Medical sciences","","","",21,"2026-01-24 10:27:37","Journal Article","10.11817/j.issn.1672-7347.2025.240642","1672-7347",,50,6,1088,1098,0,0.00,0,5,1,"Collagen membrane has attracted much attention from researchers due to its excellent properties such as wide source, degradable absorption, and low immunogenicity. However, they are limited by poor mechanical stability and rapid degradation. To enhance their physicochemical properties and biological functions, researchers have developed various strategies, including cross-linking, incorporation of growth factors or drugs, combination with other biomaterials, optimization of composition and structure, and substitution with marine-derived collagen. These advances aim to expand the clinical applications of collagen membranes in oral medicine. With the urgent demand for high-performance biomaterials in oral medicine, summarizing recent progress on collagen membranes provides valuable insights into their mechanisms, clinical efficacy, and limitations, offering reference for optimized design and broader clinical use. Furthermore, further trends may include integrating advanced manufacturing technologies to develop personalized collagen membranes, which could significantly improve therapeutic outcomes in oral diseases.","",""
0,"Ewa Dolińska, Ewa Duraj, Marcin Bernaczyk, Magdalena Sulewska, Małgorzata Pietruska","Clinical and Radiological Evaluation of Flap and Flapless Procedures with Biomaterials in Alveolar Ridge Preservation",2025,"Journal of functional biomaterials","","","",22,"2026-01-24 10:27:37","Journal Article","10.3390/jfb16090345","2079-4983",,16,9,,,0,0.00,0,5,1,"Although ridge preservation procedures have been shown to prevent post-extraction bone loss, the effectiveness of using a flap or flapless surgical approach remains unclear. The aim of the study was to compare the mentioned above alveolar ridge preservation procedures in the esthetic region of maxilla. Twenty-nine patients were randomly assigned to receive flap (n = 14) or flapless (n = 15) alveolar ridge preservation procedure. Sockets were grafted with alloplastic biomaterial, then covered with a collagen membrane in both groups. Clinical examinations were performed over a 6-month observation period and radiological (CBCT) examination was conducted before and 6 months after treatment. For both after flap and flapless procedures, there was a reduction in interdental papillae height and keratinized tissue width, increase in buccal soft tissues thickness with a decrease in radiological buccal bone plate width, decrease in radiological buccal and lingual plate height (significantly for the flapless group) and radiological alveolar process width reduction (significantly in flapless group at the height of 5 mm and 7 mm from the bottom of the socket). A decrease in the radiological buccal bone plate width was observed, where the further measuring point was from the bottom of the alveolus. In the mucoperiosteal flap preparation, group buccal bone plate width reduction at the height 3 mm, 5 mm and 7 mm was significant and in the flapless group a significant decrease was observed from 5 to 9 mm from the bottom of the socket. Despite ridge preservation, there is soft tissue thickening and a decrease in bone height and width regardless of the flap/flapless method used.","",""
