Cites,Authors,Title,Year,Source,Publisher,ArticleURL,CitesURL,GSRank,QueryDate,Type,DOI,ISSN,CitationURL,Volume,Issue,StartPage,EndPage,ECC,CitesPerYear,CitesPerAuthor,AuthorCount,Age,Abstract,FullTextURL,RelatedURL
0,"Marcos Guilherme da Cunha, Janaina de Cássia Orlandi Sardi, Irlan Almeida Freires, Marcelo Franchin, Pedro Luiz Rosalen","Antimicrobial, anti-adherence and antibiofilm activity against Staphylococcus aureus of a 4-phenyl coumarin derivative isolated from Brazilian geopropolis",2020,"Microbial pathogenesis","","","",113,"2026-01-24 10:13:04","Journal Article","10.1016/j.micpath.2019.103855","1096-1208",,139,,103855,,0,0.00,0,5,6,"The discovery of new drug candidates, especially from natural products, remains a promising approach to overcome the alarmingly high microbial resistance rates. A major 4-phenyl coumarin named cinnamoyloxy-mammeisin (CNM) isolated from stingless bee geopropolis showed interesting biological properties; however, its antimicrobial activity against Staphylococcus aureus has never been investigated. In order to clarify these properties, CNM isolated from geopropolis was initially tested against methicillin-susceptible and -resistant S. aureus strains. Further, the effects of CNM were assessed on the microbial adherence to human cells, biofilm formation and mature biofilm. Then, the acute toxicity of the compound was determined in Galleria mellonella. CNM showed bacteriostatic activity against methicillin-susceptible and -resistant S. aureus strains, with MIC of 11.3 μM. In addition, CNM at 5.7 μM reduced bacterial adherence to human keratinocytes from 1 to 3 h and disrupted biofilm formation by reducing cell viability and architecture, as evidenced by scanning electron microscopy. The acute toxicity assay indicated no significant harmful effects. Based on these findings, CNM can be considered a promising compound with anti-S. aureus properties and predicted low toxicity. Thus, it may be used as a drug candidate or lead compound for structure/activity optimization.","",""
0,"Bruno Dias Nani, Janaína de Cássia Orlandi Sardi, Josy Goldoni Lazarini, Diego Romário Silva, Adna Prado Massariolli, Thiago Mattar Cunha, Severino Matias de Alencar, Marcelo Franchin, Pedro Luiz Rosalen","Anti-inflammatory and anti-Candida Effects of Brazilian Organic Propolis, a Promising Source of Bioactive Molecules and Functional Food",2020,"Journal of agricultural and food chemistry","","","",114,"2026-01-24 10:13:04","Journal Article","10.1021/acs.jafc.8b07304","1520-5118",,68,10,2861,2871,0,0.00,0,9,6,"Brazilian organic propolis (BOP) is an unexplored Brazilian propolis that is produced organically and certified according to international legislation. Our results showed that BOP has strong anti-inflammatory effects and acts by reducing nuclear factor κB activation, tumor necrosis factor α release, and neutrophil migration. In addition, BOP6 exhibited antifungal activity on planktonic and biofilm cultures of Candida albicans, Candida glabrata, Candida tropicalis, Candida krusei, and Candida parapsisolis and reduced in vitro yeast cell adhesion to human keratinocytes at sub-inhibitory concentrations. BOP demonstrated significantly low toxicity in Galleria melonella larvae at antifungal doses. Lastly, a chemical analysis revealed the presence of caffeoyltartaric acid, 3,4-dicaffeoylquinic acid, quercetin, and gibberellins A7, A9, and A20, which may be responsible for the biological properties observed. Thus, our data indicate that BOP is a promising source of anti-inflammatory and antifungal molecules that may be used as a functional food.","",""
0,"Fulvio A Scorza, Ana C Fiorini, Antonio-Carlos G de Almeida, Carla A Scorza, Marcelo A Moret, Josef Finsterer","Re. ""To bee or not to bee? The bee extract propolis as a bioactive compound in the burden of lifestyle diseases""",2022,"Nutrition (Burbank, Los Angeles County, Calif.)","","","",92,"2026-01-24 10:13:04","Letter","10.1016/j.nut.2021.111241","1873-1244",,93,,111241,,0,0.00,0,6,4,"","",""
0,"Karen Ingrid Tasca, Fernanda Lopes Conte, Camila Renata Correa, Karina Basso Santiago, Eliza de Oliveira Cardoso, Vanessa Martinez Manfio, Jessica Leite Garcia, Andresa Aparecida Berretta, Arthur Alves Sartori, Mariana da Silva Honorio, Lenice do Rosário Souza, José Maurício Sforcin","Propolis consumption by asymptomatic HIV-individuals: Better redox state? A prospective, randomized, double-blind, placebo-controlled trial",2023,"Biomedicine & pharmacotherapy = Biomedecine & pharmacotherapie","","","",56,"2026-01-24 10:13:04","Randomized Controlled Trial","10.1016/j.biopha.2023.114626","1950-6007",,162,,114626,,0,0.00,0,12,3,"Propolis is a natural product has many biological properties of clinical interest, such as anti-inflammatory and antioxidant. Considering that people living with HIV/aids (PLWHA) on effective combined antiretroviral therapy (cART) present early aging due to an intense immune activation, inflammation, and redox imbalance, propolis consumption could offer a benefit to such patients. This double-blind longitudinal study evaluated whether Brazilian green propolis pills intake (500 mg/day for three months) would decrease the oxidative stress of virological suppressed HIV-individuals. To compare each group (propolis, n = 20 versus placebo, n = 20) in both moments (M0, before and M1, after the intervention), the following markers were assessed: plasma malondialdehyde (MDA), carbonylation, total oxide nitric, total antioxidant capacity (TAP), superoxide dismutase, catalase, and NFkB and NRF2 gene expression. Data were analyzed using Poisson, Gamma distribution and ANOVA followed by Tukey-Kramer. The groups were homogeneous regarding age, gender, time of diagnosis/ treatment, cART scheme, CD4+ T cell count, and no changes were observed in the diet food, or patients' lifestyles. A decreased MDA concentration was seen in the propolis group (M0 = 0.24 ± 0.13, M1 = 0.20 ± 0.10 protein nmol/mg; p = 0.005) as well as a slight but non-significant increase of TAP (M0 = 49.07 ± 13.26, M1 = 52.27 ± 14.86%; p = 0.06). One may conclude that propolis promoted a lower lipid peroxidation and improved the antioxidant system, suggesting that its use may be beneficial to PLWHA in an attempt to contain the intense inflammatory and oxidant activity.","",""
0,"Marcelo Franchin, Ana Sofia Martelli Chaib Saliba, Alan Giovanini de Oliveira Sartori, Sebastião Orestes Pereira Neto, Bruna Benso, Masaharu Ikegaki, Kai Wang, Severino Matias de Alencar, Daniel Granato","Food-grade delivery systems of Brazilian propolis from Apis mellifera: From chemical composition to bioactivities in vivo",2024,"Food chemistry","","","",44,"2026-01-24 10:13:04","Review","10.1016/j.foodchem.2023.137175","1873-7072",,432,,137175,,0,0.00,0,9,2,"Brazilian propolis from Apis mellifera is widely studied worldwide due to its unique chemical composition and biological properties, such as antioxidant, antimicrobial, and anti-inflammatory. However, although many countries produce honey, another bee product, the consumption of propolis as a functional ingredient is linked to hydroethanolic extract. Hence, other food uses of propolis still have to be incorporated into food systems. Assuming that propolis is a rich source of flavonoids and is regarded as a food-grade ingredient for food and pharmaceutical applications, this review provides a theoretical and practical basis for optimising the bioactive properties of Brazilian propolis, encompassing the extraction processes and incorporating its bioactive compounds in the delivery systems for food applications. Overall, pharmacotechnical resources can optimise the extraction and enhance the chemical stability of phenolic compounds to ensure the bioactivity of food formulations.","",""
212,"C.E.A. Botteon","Biosynthesis and characterization of gold nanoparticles using Brazilian red propolis and evaluation of its antimicrobial and anticancer activities",2021,"Scientific Reports","","https://www.scopus.com/inward/record.uri?partnerID=HzOxMe3b&scp=85099761142&origin=inward","https://www.scopus.com/inward/citedby.uri?partnerID=HzOxMe3b&scp=85099761142&origin=inward",5,"2026-01-24 10:12:31","Article","10.1038/s41598-021-81281-w","2045-2322",,11,1,,,212,42.40,212,1,5,"","",""
153,"M. Oroian","Influence of ultrasonic amplitude, temperature, time and solvent concentration on bioactive compounds extraction from propolis",2020,"Ultrasonics Sonochemistry","","https://www.scopus.com/inward/record.uri?partnerID=HzOxMe3b&scp=85079355609&origin=inward","https://www.scopus.com/inward/citedby.uri?partnerID=HzOxMe3b&scp=85079355609&origin=inward",8,"2026-01-24 10:12:31","Article","10.1016/j.ultsonch.2020.105021","1350-4177",,64,,,,153,25.50,153,1,6,"","",""
141,"J.F. Rivero-Cruz","Phytochemical constituents, antioxidant, cytotoxic, and antimicrobial activities of the ethanolic extract of mexican brown propolis",2020,"Antioxidants","","https://www.scopus.com/inward/record.uri?partnerID=HzOxMe3b&scp=85079146858&origin=inward","https://www.scopus.com/inward/citedby.uri?partnerID=HzOxMe3b&scp=85079146858&origin=inward",10,"2026-01-24 10:12:31","Article","10.3390/antiox9010070","2076-3921",,9,1,,,141,23.50,141,1,6,"","",""
104,"Y. Zhang","Novel porous oil-water separation material with super-hydrophobicity and super-oleophilicity prepared from beeswax, lignin, and cotton",2020,"Science of the Total Environment","","https://www.scopus.com/inward/record.uri?partnerID=HzOxMe3b&scp=85076458231&origin=inward","https://www.scopus.com/inward/citedby.uri?partnerID=HzOxMe3b&scp=85076458231&origin=inward",19,"2026-01-24 10:12:31","Article","10.1016/j.scitotenv.2019.135807","0048-9697",,706,,,,104,17.33,104,1,6,"","",""
101,"L.D. Pérez-Vergara","Development and characterization of edible films based on native cassava starch, beeswax, and propolis",2020,"Nfs Journal","","https://www.scopus.com/inward/record.uri?partnerID=HzOxMe3b&scp=85091678491&origin=inward","https://www.scopus.com/inward/citedby.uri?partnerID=HzOxMe3b&scp=85091678491&origin=inward",21,"2026-01-24 10:12:31","Article","10.1016/j.nfs.2020.09.002","2352-3646",,21,,39,49,101,16.83,101,1,6,"","",""
99,"N. Asem","Correlation between total phenolic and flavonoid contents with antioxidant activity of Malaysian stingless bee propolis extract",2020,"Journal of Apicultural Research","","https://www.scopus.com/inward/record.uri?partnerID=HzOxMe3b&scp=85075008171&origin=inward","https://www.scopus.com/inward/citedby.uri?partnerID=HzOxMe3b&scp=85075008171&origin=inward",23,"2026-01-24 10:12:31","Article","10.1080/00218839.2019.1684050","0021-8839",,59,4,437,442,99,16.50,99,1,6,"","",""
91,"E.J.G. Laureanti","Microencapsulation of bioactive compound extracts using maltodextrin and gum arabic by spray and freeze-drying techniques",2023,"International Journal of Biological Macromolecules","","https://www.scopus.com/inward/record.uri?partnerID=HzOxMe3b&scp=85172366465&origin=inward","https://www.scopus.com/inward/citedby.uri?partnerID=HzOxMe3b&scp=85172366465&origin=inward",25,"2026-01-24 10:12:31","Article","10.1016/j.ijbiomac.2023.126969","0141-8130",,253,,,,91,30.33,91,1,3,"","",""
89,"A.D. Permana","Phytosomal nanocarriers as platforms for improved delivery of natural antioxidant and photoprotective compounds in propolis: An approach for enhanced both dissolution behaviour in biorelevant media and skin retention profiles",2020,"Journal of Photochemistry and Photobiology B Biology","","https://www.scopus.com/inward/record.uri?partnerID=HzOxMe3b&scp=85081022596&origin=inward","https://www.scopus.com/inward/citedby.uri?partnerID=HzOxMe3b&scp=85081022596&origin=inward",26,"2026-01-24 10:12:31","Article","10.1016/j.jphotobiol.2020.111846","1011-1344",,205,,,,89,14.83,89,1,6,"","",""
88,"K. Pobiega","Prolonging the Shelf Life of Cherry Tomatoes by Pullulan Coating with Ethanol Extract of Propolis During Refrigerated Storage",2020,"Food and Bioprocess Technology","","https://www.scopus.com/inward/record.uri?partnerID=HzOxMe3b&scp=85087702782&origin=inward","https://www.scopus.com/inward/citedby.uri?partnerID=HzOxMe3b&scp=85087702782&origin=inward",27,"2026-01-24 10:12:31","Article","10.1007/s11947-020-02487-w","1935-5130",,13,8,1447,1461,88,14.67,88,1,6,"","",""
87,"T. Sawicki","The Profile of Polyphenolic Compounds, Contents of Total Phenolics and Flavonoids, and Antioxidant and Antimicrobial Properties of Bee Products",2022,"Molecules","","https://www.scopus.com/inward/record.uri?partnerID=HzOxMe3b&scp=85124994193&origin=inward","https://www.scopus.com/inward/citedby.uri?partnerID=HzOxMe3b&scp=85124994193&origin=inward",28,"2026-01-24 10:12:31","Article","10.3390/molecules27041301","1420-3049",,27,4,,,87,21.75,87,1,4,"","",""
85,"W. Qi","Encapsulation of β-carotene in oleogel-in-water Pickering emulsion with improved stability and bioaccessibility",2020,"International Journal of Biological Macromolecules","","https://www.scopus.com/inward/record.uri?partnerID=HzOxMe3b&scp=85089486608&origin=inward","https://www.scopus.com/inward/citedby.uri?partnerID=HzOxMe3b&scp=85089486608&origin=inward",30,"2026-01-24 10:12:31","Article","10.1016/j.ijbiomac.2020.07.227","0141-8130",,164,,1432,1442,85,14.17,85,1,6,"","",""
73,"S. Kamat","Endophytic fungus, Chaetomium globosum, associated with marine green alga, a new source of Chrysin",2020,"Scientific Reports","","https://www.scopus.com/inward/record.uri?partnerID=HzOxMe3b&scp=85094660655&origin=inward","https://www.scopus.com/inward/citedby.uri?partnerID=HzOxMe3b&scp=85094660655&origin=inward",32,"2026-01-24 10:12:31","Article","10.1038/s41598-020-72497-3","2045-2322",,10,1,,,73,12.17,73,1,6,"","",""
70,"B. Olgierd","The pluripotent activities of caffeic acid phenethyl ester",2021,"Molecules","","https://www.scopus.com/inward/record.uri?partnerID=HzOxMe3b&scp=85103919706&origin=inward","https://www.scopus.com/inward/citedby.uri?partnerID=HzOxMe3b&scp=85103919706&origin=inward",36,"2026-01-24 10:12:31","Article","10.3390/molecules26051335","1420-3049",,26,5,,,70,14.00,70,1,5,"","",""
68,"I. Dalponte Dallabona","Development of alginate beads with encapsulated jabuticaba peel and propolis extracts to achieve a new natural colorant antioxidant additive",2020,"International Journal of Biological Macromolecules","","https://www.scopus.com/inward/record.uri?partnerID=HzOxMe3b&scp=85089193741&origin=inward","https://www.scopus.com/inward/citedby.uri?partnerID=HzOxMe3b&scp=85089193741&origin=inward",37,"2026-01-24 10:12:31","Article","10.1016/j.ijbiomac.2020.07.256","0141-8130",,163,,1421,1432,68,11.33,68,1,6,"","",""
68,"F.M.d.A. de Carvalho","Brazilian red propolis: Extracts production, physicochemical characterization, and cytotoxicity profile for antitumor activity",2020,"Biomolecules","","https://www.scopus.com/inward/record.uri?partnerID=HzOxMe3b&scp=85084548656&origin=inward","https://www.scopus.com/inward/citedby.uri?partnerID=HzOxMe3b&scp=85084548656&origin=inward",38,"2026-01-24 10:12:31","Article","10.3390/biom10050726","2218-273X",,10,5,,,68,11.33,68,1,6,"","",""
56,"M.A. Shaldam","In silico screening of potent bioactive compounds from honeybee products against COVID-19 target enzymes",2021,"Environmental Science and Pollution Research","","https://www.scopus.com/inward/record.uri?partnerID=HzOxMe3b&scp=85105412526&origin=inward","https://www.scopus.com/inward/citedby.uri?partnerID=HzOxMe3b&scp=85105412526&origin=inward",43,"2026-01-24 10:12:31","Article","10.1007/s11356-021-14195-9","0944-1344",,28,30,40507,40514,56,11.20,56,1,5,"","",""
56,"S. Touzani","Determination of phenolic compounds in various propolis samples collected from an african and an asian region and their impact on antioxidant and antibacterial activities",2021,"Molecules","","https://www.scopus.com/inward/record.uri?partnerID=HzOxMe3b&scp=85112440005&origin=inward","https://www.scopus.com/inward/citedby.uri?partnerID=HzOxMe3b&scp=85112440005&origin=inward",44,"2026-01-24 10:12:31","Article","10.3390/molecules26154589","1420-3049",,26,15,,,56,11.20,56,1,5,"","",""
55,"M.L. Vică","The antimicrobial activity of honey and propolis extracts from the central region of Romania",2021,"Food Bioscience","","https://www.scopus.com/inward/record.uri?partnerID=HzOxMe3b&scp=85103270556&origin=inward","https://www.scopus.com/inward/citedby.uri?partnerID=HzOxMe3b&scp=85103270556&origin=inward",45,"2026-01-24 10:12:31","Article","10.1016/j.fbio.2021.101014","2212-4292",,41,,,,55,11.00,55,1,5,"","",""
54,"M. Chelu","Green synthesis of bioinspired chitosan-ZnO-based polysaccharide gums hydrogels with propolis extract as novel functional natural biomaterials",2022,"International Journal of Biological Macromolecules","","https://www.scopus.com/inward/record.uri?partnerID=HzOxMe3b&scp=85130122148&origin=inward","https://www.scopus.com/inward/citedby.uri?partnerID=HzOxMe3b&scp=85130122148&origin=inward",46,"2026-01-24 10:12:31","Article","10.1016/j.ijbiomac.2022.05.070","0141-8130",,211,,410,424,54,13.50,54,1,4,"","",""
53,"M. Woźniak","Biological Activity and Chemical Composition of Propolis from Various Regions of Poland",2023,"Molecules","","https://www.scopus.com/inward/record.uri?partnerID=HzOxMe3b&scp=85145701028&origin=inward","https://www.scopus.com/inward/citedby.uri?partnerID=HzOxMe3b&scp=85145701028&origin=inward",47,"2026-01-24 10:12:31","Article","10.3390/molecules28010141","1420-3049",,28,1,,,53,17.67,53,1,3,"","",""
52,"J. Wezgowiec","Polish propolis-Chemical composition and biological effects in tongue cancer cells and macrophages",2020,"Molecules","","https://www.scopus.com/inward/record.uri?partnerID=HzOxMe3b&scp=85085305679&origin=inward","https://www.scopus.com/inward/citedby.uri?partnerID=HzOxMe3b&scp=85085305679&origin=inward",52,"2026-01-24 10:12:31","Article","10.3390/molecules25102426","1420-3049",,25,10,,,52,8.67,52,1,6,"","",""
51,"S. Ceylan","Propolis loaded and genipin-crosslinked PVA/chitosan membranes; characterization properties and cytocompatibility/genotoxicity response for wound dressing applications",2021,"International Journal of Biological Macromolecules","","https://www.scopus.com/inward/record.uri?partnerID=HzOxMe3b&scp=85105787800&origin=inward","https://www.scopus.com/inward/citedby.uri?partnerID=HzOxMe3b&scp=85105787800&origin=inward",53,"2026-01-24 10:12:31","Article","10.1016/j.ijbiomac.2021.05.069","0141-8130",,181,,1196,1206,51,10.20,51,1,5,"","",""
49,"A. Parolia","Effect of propolis nanoparticles against enterococcus faecalis biofilm in the root canal",2021,"Molecules","","https://www.scopus.com/inward/record.uri?partnerID=HzOxMe3b&scp=85101441188&origin=inward","https://www.scopus.com/inward/citedby.uri?partnerID=HzOxMe3b&scp=85101441188&origin=inward",54,"2026-01-24 10:12:31","Article","10.3390/molecules26030715","1420-3049",,26,3,,,49,9.80,49,1,5,"","",""
49,"T.B. Alberti","Electrospun PVA nanoscaffolds associated with propolis nanoparticles with wound healing activity",2020,"Journal of Materials Science","","https://www.scopus.com/inward/record.uri?partnerID=HzOxMe3b&scp=85081602009&origin=inward","https://www.scopus.com/inward/citedby.uri?partnerID=HzOxMe3b&scp=85081602009&origin=inward",55,"2026-01-24 10:12:31","Article","10.1007/s10853-020-04502-z","0022-2461",,55,23,9712,9727,49,8.17,49,1,6,"","",""
49,"X.c. Zhong","Caffeic acid phenethyl ester suppresses intestinal FXR signaling and ameliorates nonalcoholic fatty liver disease by inhibiting bacterial bile salt hydrolase activity",2023,"Acta Pharmacologica Sinica","","https://www.scopus.com/inward/record.uri?partnerID=HzOxMe3b&scp=85131295746&origin=inward","https://www.scopus.com/inward/citedby.uri?partnerID=HzOxMe3b&scp=85131295746&origin=inward",56,"2026-01-24 10:12:31","Article","10.1038/s41401-022-00921-7","1671-4083",,44,1,145,156,49,16.33,49,1,3,"","",""
47,"S.N.A. Syed Salleh","Determination of Total Phenolics, Flavonoids, and Antioxidant Activity and GC-MS Analysis of Malaysian Stingless Bee Propolis Water Extracts",2021,"Scientifica","","https://www.scopus.com/inward/record.uri?partnerID=HzOxMe3b&scp=85118566240&origin=inward","https://www.scopus.com/inward/citedby.uri?partnerID=HzOxMe3b&scp=85118566240&origin=inward",57,"2026-01-24 10:12:31","Article","10.1155/2021/3789351","2090-908X",,2021,,,,47,9.40,47,1,5,"","",""
44,"E. Amalia","Water-soluble propolis and bee pollen of Trigona spp. From South Sulawesi Indonesia induce apoptosis in the human breast cancer MCF-7 cell line",2020,"Oncology Letters","","https://www.scopus.com/inward/record.uri?partnerID=HzOxMe3b&scp=85091910716&origin=inward","https://www.scopus.com/inward/citedby.uri?partnerID=HzOxMe3b&scp=85091910716&origin=inward",61,"2026-01-24 10:12:31","Article","10.3892/ol.2020.12137","1792-1074",,20,5,,,44,7.33,44,1,6,"","",""
44,"S. Ulag","Propolis-based nanofiber patches to repair corneal microbial keratitis",2021,"Molecules","","https://www.scopus.com/inward/record.uri?partnerID=HzOxMe3b&scp=85105177764&origin=inward","https://www.scopus.com/inward/citedby.uri?partnerID=HzOxMe3b&scp=85105177764&origin=inward",63,"2026-01-24 10:12:31","Article","10.3390/molecules26092577","1420-3049",,26,9,,,44,8.80,44,1,5,"","",""
44,"P. Ebadi","Evaluation of the potential in vitro effects of propolis and honey on wound healing in human dermal fibroblast cells",2021,"South African Journal of Botany","","https://www.scopus.com/inward/record.uri?partnerID=HzOxMe3b&scp=85097438683&origin=inward","https://www.scopus.com/inward/citedby.uri?partnerID=HzOxMe3b&scp=85097438683&origin=inward",64,"2026-01-24 10:12:31","Article","10.1016/j.sajb.2020.10.003","0254-6299",,137,,414,422,44,8.80,44,1,5,"","",""
43,"M.S. de Oliveira","Chemical composition of volatile compounds in apis mellifera propolis from the northeast region of pará state, brazil",2021,"Molecules","","https://www.scopus.com/inward/record.uri?partnerID=HzOxMe3b&scp=85108184213&origin=inward","https://www.scopus.com/inward/citedby.uri?partnerID=HzOxMe3b&scp=85108184213&origin=inward",66,"2026-01-24 10:12:31","Article","10.3390/molecules26113462","1420-3049",,26,11,,,43,8.60,43,1,5,"","",""
42,"C. Habryka","The effect of enriching honey with propolis on the antioxidant activity, sensory characteristics, and quality parameters",2020,"Molecules","","https://www.scopus.com/inward/record.uri?partnerID=HzOxMe3b&scp=85081210470&origin=inward","https://www.scopus.com/inward/citedby.uri?partnerID=HzOxMe3b&scp=85081210470&origin=inward",68,"2026-01-24 10:12:31","Article","10.3390/molecules25051176","1420-3049",,25,5,,,42,7.00,42,1,6,"","",""
42,"W.A.S. Mohamed","GC-MS Evaluation, Antioxidant Content, and Cytotoxic Activity of Propolis Extract from Peninsular Malaysian Stingless Bees, Tetrigona Apicalis",2020,"Evidence Based Complementary and Alternative Medicine","","https://www.scopus.com/inward/record.uri?partnerID=HzOxMe3b&scp=85098566931&origin=inward","https://www.scopus.com/inward/citedby.uri?partnerID=HzOxMe3b&scp=85098566931&origin=inward",69,"2026-01-24 10:12:31","Article","10.1155/2020/8895262","1741-427X",,2020,,,,42,7.00,42,1,6,"","",""
41,"B.D. Nani","Anti-inflammatory and anti- Candida Effects of Brazilian Organic Propolis, a Promising Source of Bioactive Molecules and Functional Food",2020,"Journal of Agricultural and Food Chemistry","","https://www.scopus.com/inward/record.uri?partnerID=HzOxMe3b&scp=85081942270&origin=inward","https://www.scopus.com/inward/citedby.uri?partnerID=HzOxMe3b&scp=85081942270&origin=inward",71,"2026-01-24 10:12:31","Article","10.1021/acs.jafc.8b07304","0021-8561",,68,10,2861,2871,41,6.83,41,1,6,"","",""
39,"R.A. Nader","Beehive products as antibacterial agents: A review",2021,"Antibiotics","","https://www.scopus.com/inward/record.uri?partnerID=HzOxMe3b&scp=85108795785&origin=inward","https://www.scopus.com/inward/citedby.uri?partnerID=HzOxMe3b&scp=85108795785&origin=inward",73,"2026-01-24 10:12:31","Article","10.3390/antibiotics10060717","2079-6382",,10,6,,,39,7.80,39,1,5,"","",""
38,"M. Ratajczak","Promising antimicrobial properties of bioactive compounds from different honeybee products",2021,"Molecules","","https://www.scopus.com/inward/record.uri?partnerID=HzOxMe3b&scp=85109961248&origin=inward","https://www.scopus.com/inward/citedby.uri?partnerID=HzOxMe3b&scp=85109961248&origin=inward",74,"2026-01-24 10:12:31","Article","10.3390/molecules26134007","1420-3049",,26,13,,,38,7.60,38,1,5,"","",""
38,"M.I. Stavropoulou","NMR metabolic profiling of Greek propolis samples: Comparative evaluation of their phytochemical compositions and investigation of their anti-ageing and antioxidant properties",2021,"Journal of Pharmaceutical and Biomedical Analysis","","https://www.scopus.com/inward/record.uri?partnerID=HzOxMe3b&scp=85097470896&origin=inward","https://www.scopus.com/inward/citedby.uri?partnerID=HzOxMe3b&scp=85097470896&origin=inward",75,"2026-01-24 10:12:31","Article","10.1016/j.jpba.2020.113814","0731-7085",,194,,,,38,7.60,38,1,5,"","",""
36,"A.B.S.d. Lima","Spectroscopy NIR and MIR toward predicting simultaneous phenolic contents and antioxidant in red propolis by multivariate analysis",2022,"Food Chemistry","","https://www.scopus.com/inward/record.uri?partnerID=HzOxMe3b&scp=85112129709&origin=inward","https://www.scopus.com/inward/citedby.uri?partnerID=HzOxMe3b&scp=85112129709&origin=inward",77,"2026-01-24 10:12:31","Article","10.1016/j.foodchem.2021.130744","0308-8146",,367,,,,36,9.00,36,1,4,"","",""
36,"M.G. da Cunha","Antimicrobial, anti-adherence and antibiofilm activity against Staphylococcus aureus of a 4-phenyl coumarin derivative isolated from Brazilian geopropolis",2020,"Microbial Pathogenesis","","https://www.scopus.com/inward/record.uri?partnerID=HzOxMe3b&scp=85074999750&origin=inward","https://www.scopus.com/inward/citedby.uri?partnerID=HzOxMe3b&scp=85074999750&origin=inward",80,"2026-01-24 10:12:31","Article","10.1016/j.micpath.2019.103855","0882-4010",,139,,,,36,6.00,36,1,6,"","",""
