Cites,Authors,Title,Year,Source,Publisher,ArticleURL,CitesURL,GSRank,QueryDate,Type,DOI,ISSN,CitationURL,Volume,Issue,StartPage,EndPage,ECC,CitesPerYear,CitesPerAuthor,AuthorCount,Age,Abstract,FullTextURL,RelatedURL
0,"Jinhong Dai, Nicholas G Fischer, Joseph R Rahimi, Hongning Wang, Chaoming Hu, Wener Chen, Yifan Lin, Ting Sang, Hooi Pin Chew, Liang Kong, Conrado Aparicio, Zhou Ye, Shengbin Huang","Interpenetrating nanofibrillar membrane of self-assembled collagen and antimicrobial peptides for enhanced bone regeneration",2024,"International journal of biological macromolecules","","","",131,"2026-01-24 10:27:37","Journal Article","10.1016/j.ijbiomac.2024.131480","1879-0003",,267,,131480,,0,0.00,0,13,2,"Bone regeneration remains a major clinical challenge, especially when infection necessitates prolonged antibiotic treatment. This study presents a membrane composed of self-assembled and interpenetrating GL13K, an antimicrobial peptide (AMP) derived from a salivary protein, in a collagen membrane for antimicrobial activity and enhanced bone regeneration. Commercially available collagen membranes were immersed in GL13K solution, and self-assembly was initiated by raising the solution pH to synthesize the multifunctional membrane called COL-GL. COL-GL was composed of interpenetrating large collagen fibers and short GL13K nanofibrils, which increased hydrophobicity, reduced biodegradation from collagenase, and stiffened the matrix compared to control collagen membranes. Incorporation of GL13K led to antimicrobial and anti-fouling activity against early oral surface colonizer Streptococcus gordonii while not affecting fibroblast cytocompatibility or pre-osteoblast osteogenic differentiation. GL13K in solution also reduced macrophage inflammatory cytokine expression and increased pro-healing cytokine expression. Bone formation in a rat calvarial model was accelerated at eight weeks with COL-GL compared to the gold-standard collagen membrane based on microcomputed tomography and histology. Interpenetration of GL13K within collagen sidesteps challenges with antimicrobial coatings on bone regeneration scaffolds while increasing bone regeneration. This strength makes COL-GL a promising approach to reduce post-surgical infections and aid bone regeneration in dental and orthopedic applications. STATEMENT OF SIGNIFICANCE: The COL-GL membrane, incorporating the antimicrobial peptide GL13K within a collagen membrane, signifies a noteworthy breakthrough in bone regeneration strategies for dental and orthopedic applications. By integrating self-assembled GL13K nanofibers into the membrane, this study successfully addresses the challenges associated with antimicrobial coatings, exhibiting improved antimicrobial and anti-fouling activity while preserving compatibility with fibroblasts and pre-osteoblasts. The accelerated bone formation observed in a rat calvarial model emphasizes the potential of this innovative approach to minimize post-surgical infections and enhance bone regeneration outcomes. As a promising alternative for future therapeutic interventions, this material tackles the clinical challenges of extended antibiotic treatments and antibiotic resistance in bone regeneration scenarios.","",""
0,"Mehdi Keddar, Laurence Evrard, Firas Shall","Horizontal ridge augmentation using guided bone regeneration with an association of particulate allografts mixed with platelet-rich fibrin, collagen membrane and tent-screws: A prospective study",2024,"Journal of stomatology, oral and maxillofacial surgery","","","",132,"2026-01-24 10:27:37","Journal Article","10.1016/j.jormas.2024.101872","2468-7855",,125,12,101872,,0,0.00,0,3,2,"Guided Bone Regeneration (GBR) is a versatile technique employed not only to correct pre-implant alveolar bone defects but also to facilitate bone defect correction during simultaneous implant placement. The effectiveness of GBR varies significantly among different protocols, as reported in the literature. This study specifically aimed to radiologically evaluate the horizontal bone gain obtained using a GBR procedure combining a particulate allograft, platelet-rich fibrin, resorbable collagen membrane, and screw tents. A total of 42 patients with an insufficient alveolar bone width for dental implant placement were treated with a GBR technique using a mixture of particulate allograft (demineralised freeze-dried bone allograft 300-500 and 500-1000 µm), advanced platelet-rich fibrin (A-PRF), resorbable collagen membranes and screws tents (1.2 mm in diameter). Over the course of the study, a total of 63 GBR procedures were performed on these patients. Bone gains were measured by cone-beam computed tomography at 9.1 ± 2.0 months post-operative. A significant mean increase (P < 0.001) of 3.2 ± 0.9 mm at the sites of the greatest bone defect was observed. This improvement was consistent across various locations, including both maxillary and mandibular regions, and in cases of terminal and embedded edentulism, without any post-operative complications during the entire post-operative follow-up. All patients benefited from implant placement following the bone augmentation protocol. GBR combining particulate allografts, A-PRF, collagen membranes, and screw tents achieves reliable, predictable, and reproducible clinical gains that allow for future implant placement.","",""
0,"Karol Ali Apaza Alccayhuaman, Patrick Heimel, Stefan Tangl, Stefan Lettner, Carina Kampleitner, Layla Panahipour, Ulrike Kuchler, Reinhard Gruber","Active and Passive Mineralization of Bio-Gide® Membranes in Rat Calvaria Defects",2024,"Journal of functional biomaterials","","","",134,"2026-01-24 10:27:37","Journal Article","10.3390/jfb15030054","2079-4983",,15,3,,,0,0.00,0,8,2,"Bio-Gide® is a collagen membrane routinely used in guided bone regeneration. Recent studies have shown that this collagen membrane has osteoconductive properties, meaning that it can support the growth of new bone. However, it has also been observed that the collagen membrane has areas of mineralized fibers which can occur spontaneously and independently of osteoblasts. To better understand how this works, we established a model using minced collagen membranes to reduce the active mineralization of intact collagen membranes in favor of passive mineralization. We thus compared the original intact membrane with a minced collagen membrane in a 5 mm calvarial defect model in Sprague Dawley rats. After three weeks of healing, histology and microcomputed tomography (μCT) were performed. Histological analysis confirmed the osteoconductive properties, with new bone growing inside the intact collagen membrane. However, in minced collagen membranes, the osteoconductive properties were restricted to the defect margins. Interestingly, histology revealed large mineralized areas indicating passive mineralization with no signs of bone formation. In the μCT analysis, the intact collagen membranes caused a higher median mineralized volume (1.5 mm3) compared with the minced group (0.4 mm3), but this lacked significance (p = 0.09). The μCT analysis needs to be interpreted carefully, particularly in defects filled with minced membranes, considering that the mineralized tissue may not necessarily be bone but also the result of passive mineralization. Taken together, the findings suggest that Bio-Gide® collagen membranes support bone formation while also exhibiting potential for passive mineralization.","",""
0,"Se-Wook Pyo, Jeong-Won Paik, Da-Na Lee, Young-Wook Seo, Jin-Young Park, Sunjai Kim, Seong-Ho Choi","Comparative Analysis of Bone Regeneration According to Particle Type and Barrier Membrane for Octacalcium Phosphate Grafted into Rabbit Calvarial Defects",2024,"Bioengineering (Basel, Switzerland)","","","",135,"2026-01-24 10:27:37","Journal Article","10.3390/bioengineering11030215","2306-5354",,11,3,,,0,0.00,0,7,2,"This animal study was aimed to evaluate the efficacy of new bone formation and volume maintenance according to the particle type and the collagen membrane function for grafted octacalcium phosphate (OCP) in rabbit calvarial defects. The synthetic bone substitutes were prepared in powder form with 90% OCP and granular form with 76% OCP, respectively. The calvarial defects were divided into four groups according to the particle type and the membrane application. All specimens were acquired 2 weeks (n = 5) and 8 weeks (n = 5) after surgery. According to the micro-CT results, the new bone volume increased at 2 weeks in the 76% OCP groups compared to the 90% OCP groups, and the bone volume ratio was significantly lower in the 90% OCP group after 2 weeks. The histomorphometric analysis results indicated that the new bone area and its ratio in all experimental groups were increased at 8 weeks except for the group with 90% OCP without a membrane. Furthermore, the residual bone graft area and its ratio in the 90% OCP groups were decreased at 8 weeks. In conclusion, all types of OCP could be applied as biocompatible bone graft materials regardless of its density and membrane application. Neither the OCP concentration nor the membrane application had a significant effect on new bone formation in the defect area, but the higher the OCP concentration, the less graft volume maintenance was needed.","",""
0,"Giusy Rita Maria La Rosa, Carlotta Ylenia Priolo, Roula S Abiad, Virginia Rosy Romeo, Emanuele Ambu, Eugenio Pedullà","Assessment of bone regeneration after maxillary radicular cyst enucleation with or without bone grafting materials: a retrospective cohort study",2024,"Clinical oral investigations","","","",137,"2026-01-24 10:27:37","Journal Article","10.1007/s00784-024-05612-7","1436-3771",,28,4,213,,0,0.00,0,6,2,"The limitations of spontaneous bone healing underscore the necessity for exploring alternative strategies to enhance bone regeneration in maxillary radicular cyst cases. This retrospective study aimed to assess the impact of a bone substitute material (i.e., Bio-Oss) on bone volume regeneration following maxillary radicular cyst enucleation using cone-beam computed tomography (CBCT). Seventy-three patients with maxillary radicular cysts were divided into two groups: one undergoing guided bone regeneration (GBR) with Bio-Oss and absorbable collagen membrane (n = 35), and the other receiving cyst excision alone (n = 38). Volumetric measurements using Amira software on CBCT scans evaluated bone regeneration, with cystic lesion shrinkage rates calculated. Intergroup comparisons utilized independent sample t-tests (P < 0.05), and linear regression analysis assessed the influence of preoperative cyst volume and group on bone healing. Both groups showed similar success rates in bone formation at the 12-month follow-up, with no significant differences between them (mean (SD), control: 75.16 (19.17) vs. GBR: 82 (20.22), P > 0.05). Linear regression analysis revealed a negative correlation between preoperative cyst volume and bone regeneration in both groups (P < 0.05). Bio-Oss may not significantly enhance bone augmentation in maxillary radicular cysts. In addition, preoperative cyst volume negatively affected the shrinkage rate of cystic lesions. Clinicians should consider patient-specific factors such as anatomy and lesion size when determining the need for bone substitute materials. Future research could focus on optimizing treatment protocols and alternative regenerative strategies to improve patient outcomes in maxillary cyst cases.","",""
0,"Takahisa Iida, Michihide Miki, Mauro Ferri, Fernando M Muñoz Guzon, Gianfranco Cesaretti, Daniele Botticelli","Alveolar Buccal Bone Overbuilding Before Tooth Extraction: A Preclinical Study",2024,"The International journal of oral & maxillofacial implants","","","",138,"2026-01-24 10:27:37","Journal Article","10.11607/jomi.10754","1942-4434",,39,5,713,722,0,0.00,0,6,2,"To evaluate the dimensional changes in the alveolar crest after buccal overbuilding was performed prior to tooth extraction in a dog model. At the test sites, alveolar crest overbuilding was performed on the buccal aspect of the distal root of the third premolar using xenograft covered with a collagen membrane. No treatment was applied at the control sites. After 3 months, the distal roots of both third premolars were extracted and implants were immediately placed into the alveolus, allowing nonsubmerged healing. After 3 months, biopsy samples were collected. Upon histologic analysis, no statistically significant differences in hard tissue dimensions were found. The buccal bone plate at the test sites presented a tendency for higher resorption compared to the control sites. However, if the contribution of the residue of biomaterial is considered, a higher volumetric gain was registered at the test than at the control sites. The buccal overbuilding performed prior to tooth extraction did not contribute to the preservation of the alveolar crest dimensions after extraction. This could be due to failure to incorporate the graft into the newly formed bone.","",""
0,"Florence Dewilde, Matthijs Hindryckx, Faris Younes, Thomas De Bruyckere, Jan Cosyn","Lateral bone augmentation with a composite graft covered with a stretched and pinned collagen membrane: A retrospective case series using cone-beam computed tomography",2024,"Clinical implant dentistry and related research","","","",140,"2026-01-24 10:27:37","Journal Article","10.1111/cid.13313","1708-8208",,26,3,545,553,0,0.00,0,5,2,"(1) To assess the effectiveness of the Sausage Technique™ when applied for lateral bone augmentation by multiple experienced clinicians; (2) To identify risk indicators for a poor outcome and to assess the need for adjunctive surgery. All patients who had been treated with the Sausage Technique™ for lateral bone augmentation by three experienced surgeons between January 2019 and December 2021 were included in a retrospective case series. The Sausage Technique™ technique includes the use of autogenous bone chips and deproteinized bovine bone mineral (1:1 ratio), covered with a stretched and pinned collagen membrane. The increase in alveolar width between the pre-operative situation and 9 months was assessed at different levels on superimposed cone-beam CT scans. Twenty-five augmentations performed in 25 patients (17 males, 8 females, mean age 51 years) were available for evaluation. Mean alveolar width increased from 4.35 to 7.43 mm at 3 mm below the crest. The mean increase of 3.08 mm (95% CI 2.10-4.06; p < 0.001) was significant. The outcome of non-containing single implant sites was significantly worse than the outcome of other sites (MD 2.67 mm; p = 0.008). The need for regrafting was 4% and the need for soft tissue augmentation was 48%. Twenty percent of the patients needed soft tissue augmentation due to a lack of keratinized mucosa width, and 32% due to a lack of buccal convexity. The former was mainly needed at multiple implant sites, whereas the latter was mainly required at single implant sites. All implant survived and remained healthy until the final follow-up. The Sausage Technique™ is an effective bone augmentation technique. Non-containing single implant sites were associated with a poor outcome and adjunctive soft tissue augmentation was needed in about half of the patients.","",""
0,"Mario Beretta, Mattia Manfredini, Claudia Paola Bruna Dellavia, Gaia Pellegrini, Carlo Maiorana, Pier Paolo Poli","Xenograft Combined with a Mixture of Polynucleotides and Hyaluronic Acid (PN-HA) for Horizontal Alveolar Bone Regeneration: Clinical and Histologic Assessments in a Case Series",2025,"The International journal of periodontics & restorative dentistry","","","",141,"2026-01-24 10:27:37","Journal Article","10.11607/prd.7042","1945-3388",,45,2,209,219,0,0.00,0,6,1,"The present case series aims to investigate the use of polynucleotides mixed with hyaluronic acid (PN-HA) in a gel form to promote bone regeneration in horizontal alveolar defects. Overall, six adult patients underwent localized horizontal guided bone regeneration by means of xenogeneic bone substitute and a resorbable barrier with a staged approach. The graft was a mixture of deproteinized bovine bone mineral (DBBM) particles and PN-HA gel in a 3:1 ratio, respectively. The material was covered by a resorbable collagen membrane fixed with pins to the underlying bone. Implant placement was performed after 5 months. Healing proceeded uneventfully, and, upon reentry, the graft appeared well vascularized and firmly attached to the recipient bone. Histologically, the regenerated bone appeared highly mineralized and well-organized in lamellae, and the residual biomaterial granules were completely embedded. Histomorphometric evaluations revealed that newly formed boneoccupied an average of 41.2% ± 12.4% of the analyzed samples. Linear measurements performed on CBCT scans yielded an overall linear horizontal bone gain of 4.91 ± 0.88 mm. These data suggest that a mixture of DBBM and PN-HA can be safely used to promote bone regeneration in cases of horizontal alveolar defects.","",""
0,"Niyaz Al-Sharabi, Samih Mohamed-Ahmed, Siddharth Shanbhag, Carina Kampleitner, Rammah Elnour, Shuntaro Yamada, Neha Rana, Even Birkeland, Stefan Tangl, Reinhard Gruber, Kamal Mustafa","Osteogenic human MSC-derived extracellular vesicles regulate MSC activity and osteogenic differentiation and promote bone regeneration in a rat calvarial defect model",2024,"Stem cell research & therapy","","","",142,"2026-01-24 10:27:37","Journal Article","10.1186/s13287-024-03639-x","1757-6512",,15,1,33,,0,0.00,0,11,2,"There is growing evidence that extracellular vesicles (EVs) play a crucial role in the paracrine mechanisms of transplanted human mesenchymal stem cells (hMSCs). Little is known, however, about the influence of microenvironmental stimuli on the osteogenic effects of EVs. This study aimed to investigate the properties and functions of EVs derived from undifferentiated hMSC (Naïve-EVs) and hMSC during the early stage of osteogenesis (Osteo-EVs). A further aim was to assess the osteoinductive potential of Osteo-EVs for bone regeneration in rat calvarial defects. EVs from both groups were isolated using size-exclusion chromatography and characterized by size distribution, morphology, flow cytometry analysis and proteome profiling. The effects of EVs (10 µg/ml) on the proliferation, migration, and osteogenic differentiation of cultured hMSC were evaluated. Osteo-EVs (50 µg) or serum-free medium (SFM, control) were combined with collagen membrane scaffold (MEM) to repair critical-sized calvarial bone defects in male Lewis rats and the efficacy was assessed using µCT, histology and histomorphometry. Although Osteo- and Naïve-EVs have similar characteristics, proteomic analysis revealed an enrichment of bone-related proteins in Osteo-EVs. Both groups enhance cultured hMSC proliferation and migration, but Osteo-EVs demonstrate greater efficacy in promoting in vitro osteogenic differentiation, as evidenced by increased expression of osteogenesis-related genes, and higher calcium deposition. In rat calvarial defects, MEM with Osteo-EVs led to greater and more consistent bone regeneration than MEM loaded with SFM. This study discloses differences in the protein profile and functional effects of EVs obtained from naïve hMSC and hMSC during the early stage of osteogenesis, using different methods. The significant protein profile and cellular function of EVs derived from hMSC during the early stage of osteogenesis were further verified by a calvarial bone defect model, emphasizing the importance of using differentiated MSC to produce EVs for bone therapeutics.","",""
0,"Taito Watanabe, Akira Hasuike, Shin Wakuda, Keisuke Kogure, Seiko Min, Norihisa Watanabe, Ryo Sakai, Akhilanand Chaurasia, Yoshinori Arai, Shuichi Sato","Resorbable bilayer membrane made of L-lactide-ε-caprolactone in guided bone regeneration: an in vivo experimental study",2024,"International journal of implant dentistry","","","",143,"2026-01-24 10:27:37","Journal Article","10.1186/s40729-024-00520-7","2198-4034",,10,1,1,,0,0.00,0,10,2,"Guided bone regeneration (GBR) is an accepted method in dental practice that can successfully increase the bone volume of the host at sites chosen for implant placement; however, existing GBR membranes exhibit rapid absorption and lack of adequate space maintenance capabilities. We aimed to compare the effectiveness of a newly developed resorbable bilayer membrane composed of poly (L-lactic acid) and poly (-caprolactone) (PLACL) with that of a collagen membrane in a rat GBR model. The rat calvaria was used as an experimental model, in which a plastic cylinder was placed. We operated on 40 male Fisher rats and subsequently performed micro-computed tomography and histomorphometric analyses to assess bone regeneration. Significant bone regeneration was observed, which was and similar across all the experimental groups. However, after 24 weeks, the PLACL membrane demonstrated significant resilience, and sporadic partial degradation. This extended preservation of the barrier effect has great potential to facilitate optimal bone regeneration. The PLACL membrane is a promising alternative to GBR. By providing a durable barrier and supporting bone regeneration over an extended period, this resorbable bilayer membrane could address the limitations of the current membranes. Nevertheless, further studies and clinical trials are warranted to validate the efficacy and safety of The PLACL membrane in humans.","",""
0,"Edith Umasi Ramos, Miguel Nino Chávez Leandro, Jesús Omar Cárdenas Criales, Marisol Rossana Ortega Buitron, Edgar Simón Verástegui, Wilbert Manzanedo Carbajal, Ronald Christian Solís Adrianzén, Anibal Eleuterio Espinoza Grijalva, Antonio Alberto Ballarte Baylon, Ana Paula Farnezi Bassi","Evaluation of Porcine Collagen Membranes Used with Guided Bone Regeneration for Critical Defects: A Histological, Histomorphometric, Immunohistochemical, and Inflammatory Profile Analysis",2024,"European journal of dentistry","","","",144,"2026-01-24 10:27:37","Journal Article","10.1055/s-0043-1777045","1305-7456",,18,3,898,906,0,0.00,0,10,2," The objective of this study was to compare the effectiveness of two porcine collagen membranes of different origin used for guided bone regeneration procedures.  Resorbable collagen membrane from porcine dermis (Bio-Gide, Geistlich Pharma AG, Wolhusen, Switzerland) and resorbable collagen membrane from porcine pericardium (Jason, Institut Straumann AG, Peter Merian-Weg, Switzerland) were evaluated; histological, histometric, immunohistochemical, and inflammatory profile analyses were performed. The study was carried out on critical defects created in the calvaria of 72 rats (Rattus norvegicus albinus, Wistar variety) divided into three groups: coagulum group (Co), porcine pericardium group (JS), and porcine collagen group (BG). The defects were filled with clot, over which the membranes were placed. The animals were euthanized 7, 15, 30, and 60 days after surgery.  The Shapiro-Wilk test was used to assess data distribution. Analysis of variance (ANOVA) and the Bonferroni multiple comparison test were used to compare the differences across the mean values of the variables. Nonparametric tests, Mann-Whitney and Wilcoxon W, were used for the quantitative analysis of the inflammatory profile. A significance level of 5% (p < 0.05) was adopted with a confidence interval of 95%. SPSS software version 2.0 was used.  A total of 1,008 analyses were performed on 288 histological slides. It was noted that both types of collagen membranes used in this study were effective for the guided bone regeneration procedure, with a greater proportion and thickness of bone formation among recipients of the BG (735 points, p = 0.021). This membrane also had greater permeability (62.25). The animals in the JS group, which received the porcine pericardial membrane, showed early and accelerated bone formation from early bone tissue, milder osteopontin and osteocalcin levels, and greater inflammatory reaction (86.4).  The collagen membrane from porcine dermis demonstrated a more orderly and physiological repair process, while the porcine pericardial membrane presented a more accelerated repair process that did not remain constant over time.","",""
