Cites,Authors,Title,Year,Source,Publisher,ArticleURL,CitesURL,GSRank,QueryDate,Type,DOI,ISSN,CitationURL,Volume,Issue,StartPage,EndPage,ECC,CitesPerYear,CitesPerAuthor,AuthorCount,Age,Abstract,FullTextURL,RelatedURL
0,"Patrick Rider, Željka Perić Kačarević, Akiva Elad, Drazen Tadic, Daniel Rothamel, Gerrit Sauer, Fabien Bornert, Peter Windisch, Dávid Botond Hangyási, Balint Molnar, Emely Bortel, Bernhard Hesse, Frank Witte","Biodegradable magnesium barrier membrane used for guided bone regeneration in dental surgery",2022,"Bioactive materials","","","",113,"2026-01-24 10:23:41","Journal Article","10.1016/j.bioactmat.2021.11.018","2452-199X",,14,,152,168,0,0.00,0,13,4,"Barrier membranes are commonly used as part of the dental surgical technique guided bone regeneration (GBR) and are often made of resorbable collagen or non-resorbable materials such as PTFE. While collagen membranes do not provide sufficient mechanical protection of the covered bone defect, titanium reinforced membranes and non-resorbable membranes need to be removed in a second surgery. Thus, biodegradable GBR membranes made of pure magnesium might be an alternative. In this study a biodegradable pure magnesium (99.95%) membrane has been proven to have all of the necessary requirements for an optimal regenerative outcome from both a mechanical and biological perspective. After implantation, the magnesium membrane separates the regenerating bone from the overlying, faster proliferating soft tissue. During the initial healing period, the membrane maintained a barrier function and space provision, whilst retaining the positioning of the bone graft material within the defect space. As the magnesium metal corroded, it formed a salty corrosion layer and local gas cavities, both of which extended the functional lifespan of the membrane barrier capabilities. During the resorption of the magnesium metal and magnesium salts, it was observed that the membrane became surrounded and then replaced by new bone. After the membrane had completely resorbed, only healthy tissue remained. The in vivo performance study demonstrated that the magnesium membrane has a comparable healing response and tissue regeneration to that of a resorbable collagen membrane. Overall, the magnesium membrane demonstrated all of the ideal qualities for a barrier membrane used in GBR treatment.","",""
0,"Yikun Xu, Eri Hirata, Yoko Iizumi, Natsumi Ushijima, Keisuke Kubota, Sadahito Kimura, Yukari Maeda, Toshiya Okazaki, Atsuro Yokoyama","Single-Walled Carbon Nanotube Membranes Accelerate Active Osteogenesis in Bone Defects: Potential of Guided Bone Regeneration Membranes",2022,"ACS biomaterials science & engineering","","","",114,"2026-01-24 10:23:41","Journal Article","10.1021/acsbiomaterials.1c01542","2373-9878",,8,4,1667,1675,0,0.00,0,9,4,"Carbon nanotubes (CNTs) are potentially important biomaterials because of their chemical, physical, and biological properties. Our research indicates that CNTs exhibit high compatibility with bone tissue. The guided bone regeneration (GBR) technique is commonly applied to reconstruct alveolar bone and treat peri-implant bone defects. In GBR, bone defects are covered with a barrier membrane to prevent the entry of nonosteogenic cells such as epithelial cells and fibroblasts. The barrier membrane also maintains a space for new bone formation. However, the mechanical and biological properties of materials previously used in clinical practice sometimes delayed bone regeneration. In this study, we developed a CNT-based membrane for GBR exhibiting high strength to provide a space for bone formation and provide cellular shielding to induce osteogenesis. The CNT membrane was made via the dispersion of single-walled CNTs (SWCNTs) in hyaluronic acid solution followed by filtration. The CNT membrane assumed a nanostructure surface due to the bundled SWCNTs and exhibited high strength and hydrophilicity after oxidation. In addition, the membrane promoted the proliferation of osteoblasts but not nonosteogenic cells. CNT membranes were used to cover experimental bone defects made in rat calvaria. At 8 weeks after surgery, more extensive bone formation was observed in membrane-covered defects compared with bone defects not covered with membrane. Almost no diffusion of CNTs was observed around the membrane. These results indicate that the CNT membrane has adequate strength, stability, and surface characteristics for osteoblasts, and its shielding properties promote bone formation. Demonstration of the safety and osteogenic potential of the CNT membranes through further animal studies should facilitate their clinical application in GBR.","",""
0,"Behnaz Malekahmadi, Vahid Esfahanian, Fatemeh Ejeian, Maziar Ebrahimi Dastgurdi, Maria Agheb, Faranak Kaveian, Mohammad Rafienia, Mohammad Hossein Nasr-Esfahani","In Vitro Study of the Recruitment and Expansion of Mesenchymal Stem Cells at the Interface of a Cu-Doped PCL-Bioglass Scaffold",2022,"Biomimetics (Basel, Switzerland)","","","",115,"2026-01-24 10:23:41","Journal Article","10.3390/biomimetics7010019","2313-7673",,7,1,,,0,0.00,0,8,4,"Developing new barrier membranes with improved biomechanical characteristics has acquired much interest owing to their crucial role in the field of periodontal tissue regeneration. In this regard, we enriched the electrospun polycaprolactone (PCL)/gelatin (Gel) membranes by adding bioglass (BG) or Cu-doped bioglass (CuBG) and examined their cellular adhesion and proliferation potential in the presence of alveolar bone marrow-derived mesenchymal stem cells (aBMSCs). The membranes were fabricated and characterized using mechanical strength, SEM, FTIR, EDX, and ICP assay. Besides, aBMSCs were isolated, characterized, and seeded with a density of 35,000 cells in each experimental group. Next, the cellular morphology, cell adhesion capacity, proliferation rate, and membrane antibacterial activity were assessed. The results displayed a significant improvement in the wettability, pore size, and Young's modulus of the PCL membrane following the incorporation of gelatin and CuBG particles. Moreover, all scaffolds exhibited reasonable biocompatibility and bioactivity in physiological conditions. Although the PCL/Gel/CuBG membrane revealed the lowest primary cell attachment, cells were grown properly and reached the confluent state after seven days. In conclusion, we found a reasonable level of attachment and proliferation of aBMSCs on all modified membranes. Meanwhile, a trace amount of Cu provided superiority for PCL/Gel/CuBG in periodontal tissue regeneration.","",""
0,"Gabriela L Abe, Ririko Tsuboi, Haruaki Kitagawa, Jun-Ichi Sasaki, Aonan Li, Tomoki Kohno, Satoshi Imazato","Poly(lactic acid/caprolactone) bilayer membrane blocks bacterial penetration",2022,"Journal of periodontal research","","","",116,"2026-01-24 10:23:41","Journal Article","10.1111/jre.12980","1600-0765",,57,3,510,518,0,0.00,0,7,4,"The clinical outcomes of guided tissue regeneration (GTR) or guided bone regeneration (GBR) procedures can be impaired if a bacterial infection develops at the surgical site. Membrane exposure is one of the causes of the onset of bacterial infection. Previously, we have fabricated a poly(lactic acid/caprolactone) (PLCL) bilayer membrane composed of a porous layer and a compact layer. The compact layer acts as a barrier against connective tissue and epithelial cells, and we hypothesized that it could also be an effective barrier against bacterial cells. The objective of this study was to evaluate the ability of the PLCL bilayer membrane to block bacterial cell penetration, which would be useful for preventing postoperative infections. Porphyromonas gingivalis, Streptococcus mutans, and multispecies bacteria collected from human saliva were used in this study. Bacteria were seeded directly on the compact layer of a PLCL bilayer membrane, and bacterial adhesion to the membrane, as well as penetration into the membrane's structure, were assessed. Bacterial adhesion was evaluated by the number of colonies formed at 6, 24, and 72 h, and penetration was observed using a scanning electron microscope at 24 and 72 h. Commercially available membranes, composed of poly(lactic-co-glycolic acid) or type I collagen, were used as controls. P. gingivalis, S. mutans, and the multispecies bacteria obtained from human saliva adhered onto all the membranes after only 6 h of incubation. However, fewer adherent cells were observed for the PLCL bilayer membrane compared with the controls for all experimental periods. The PLCL membrane was capable of blocking bacterial penetration, and no bacterial cells were observed in the structure. In contrast, bacteria penetrated both the control membranes and were observed at depths of up to 80 µm after 72 h of incubation. Membrane characteristics may influence how bacterial colonization occurs. The PLCL membrane had reduced bacterial adhesion and blocked bacterial penetration, and these characteristics could contribute to a favorable outcome for regenerative treatments. In the event of membrane exposure at GTR/GBR surgical sites, membranes with an efficient barrier function, such as the PLCL bilayer membrane, could simplify the management of GTR/GBR complications.","",""
0,"Yaowei Xuan, Lin Li, Muzhi Ma, Junkai Cao, Zhen Zhang","Hierarchical Intrafibrillarly Mineralized Collagen Membrane Promotes Guided Bone Regeneration and Regulates M2 Macrophage Polarization",2021,"Frontiers in bioengineering and biotechnology","","","",117,"2026-01-24 10:23:41","Journal Article","10.3389/fbioe.2021.781268","2296-4185",,9,,781268,,0,0.00,0,5,5,"Mineralized collagen has been introduced as a promising barrier membrane material for guided bone regeneration (GBR) due to its biomimetic nanostructure. Immune interaction between materials and host significantly influences the outcome of GBR. However, current barrier membranes are insufficient for clinical application due to limited mechanical or osteoimmunomodulatory properties. In this study, we fabricated hierarchical intrafibrillarly mineralized collagen (HIMC) membrane, comparing with collagen (COL) and extrafibrillarly mineralized collagen (EMC) membranes, HIMC membrane exhibited preferable physicochemical properties by mimicking the nanostructure of natural bone. Bone marrow mesenchymal stem cells (BMSCs) seeded on HIMC membrane showed superior proliferation, adhesion, and osteogenic differentiation capacity. HIMC membrane induced CD206+Arg-1+ M2 macrophage polarization, which in turn promoted more BMSCs migration. In rat skull defects, HIMC membrane promoted the regeneration of new bone with more bone mass and more mature bone architecture. The expression levels of Runx2 and osterix and CD68 + CD206 + M2 macrophage polarization were significantly enhanced. HIMC membrane provides an appropriate osteoimmune microenvironment to promote GBR and represents a promising material for further clinical application.","",""
0,"Ignacio Sanz-Sánchez, Ignacio Sanz-Martín, Alberto Ortiz-Vigón, Ana Molina, Mariano Sanz","Complications in bone-grafting procedures: Classification and management",2022,"Periodontology 2000","","","",118,"2026-01-24 10:23:41","Journal Article","10.1111/prd.12413","1600-0757",,88,1,86,102,0,0.00,0,5,4,"Bone-regenerative interventions aiming to restore deficient alveolar ridges, such as the use of block grafts or through the application of guided bone-regeneration principles, have reported positive outcomes in the published scientific literature. These interventions, however, are invasive, and hence, intraoperative and/or postoperative complications may occur. The types of complications and their severity may vary from the exposure of the biomaterial (membrane or graft) to postsurgical infections, neurosensorial disturbances, occurrence of hemorrhage, and pain, etc. The aim of the present narrative review was to search the available scientific evidence concerning the incidence of these complications, their effect on treatment outcomes, their clinical management and, finally, strategies aimed at prevention. Exposure of the barrier membrane or the block graft is the most common complication associated with oral regenerative interventions. To manage these complications, depending on the extent of the exposure and the presence or absence of concomitant infections, therapeutic measures may vary, from the topical application of antiseptics to the removal of the barrier membrane or the block graft. Regardless of their treatment, the occurrence of these complications has been associated with patient selection, with compliant patients (eg, nonsmokers) having a lower reported incidence of complications. Similarly, surgical factors such as correct flap elevation and a tensionless closure are of obvious importance. Finally, to prevent the incidence of complications, it appears prudent to utilize whenever possible less invasive surgical interventions.","",""
0,"John Rong Hao Tay, Ethan Ng, Xiaotong Jacinta Lu, Wei Ming Clement Lai","Healing complications and their detrimental effects on bone gain in vertical-guided bone regeneration: A systematic review and meta-analysis",2022,"Clinical implant dentistry and related research","","","",119,"2026-01-24 10:23:41","Journal Article","10.1111/cid.13057","1708-8208",,24,1,43,71,0,0.00,0,4,4,"Guided bone regeneration (GBR) utilizes a barrier membrane to allow osteogenic cells to populate a space by excluding epithelial and connective tissue cells. The purpose of this systematic review was to investigate the ratio of means (RoM) of vertical bone gained (Outcome) in vertical GBR procedures with healing complications (Intervention) and in vertical GBR procedures without healing complications (Comparison) in patients with vertically resorbed edentulous ridges that require dental implant placement (Population). A further aim was to investigate the incidence of complications after vertical GBR, and the influence of the timing of implant placement and regenerative devices on complications. MEDLINE (through PubMed), EMBASE, and Cochrane Central Register of Controlled Trials (CENTRAL) were searched in duplicate up to, and including, November 2020 for randomized and controlled clinical trials and prospective and retrospective case series. Outcomes included patient-level and site-level RoM of vertical bone gain between healing complications and uneventful healing, and incidences of complications that occurred after vertical GBR. Random-effects and fixed-effects meta-analyses were performed where appropriate. This study was registered on PROSPERO (CRD42021226432). A total of 31 publications were selected for the qualitative and quantitative analyses. The RoM of vertical bone gained was 0.65 [95% CI = 0.47, 0.91] and 0.62 [95% CI = 0.45, 0.85] when membrane exposure without suppuration and abscess formation without membrane exposure occurred respectively, in comparison to uneventful healing. The overall incidence proportion of healing complications occurring at the augmented site at a site- and patient-level was 11.0% [95% CI = 7.0, 15.6] and 10.8% [95% CI = 6.6, 15.7]. At a patient-level, there were no significant differences between a simultaneous or staged approach, or with the regenerative device used. The site-level incidence proportion of membrane exposure without suppuration, membrane exposure with suppuration, and with abscess formation without membrane exposure was 8.7% [95% CI = 4.2, 14.2], 0.7% [95% CI = 0.0, 2.9], and 0.5% [95% CI = 0.0, 1.7], respectively. The site-level weighted mean incidence proportion of neurologic complications occurring at the donor site was 0.8% [95% CI = 0.0, 5.3]. There is a significant reduction in bone gain when healing complications occur. However, healing complications are relatively uncommon surgical complications after vertical GBR.","",""
0,"Kinuko Ogata, Seigo Ohba, Yoshinori Sumita, Izumi Ashahina","Safety and feasibility assessment of biodegradable poly (l-lactic acid/ε-caprolactone) membrane for guided bone regeneration: A case series of first-in-human pilot study",2022,"Journal of dental sciences","","","",120,"2026-01-24 10:23:41","Journal Article","10.1016/j.jds.2021.08.015","2213-8862",,17,1,368,376,0,0.00,0,4,4,"Guided bone regeneration (GBR) is the most popular technique for alveolar ridge augmentation in implant dentistry, and resorbable cell barrier membrane, made of collagen, is widely used. We tried to develop a new resorbable cell barrier membrane from an animal-free product. This study aimed to investigate the safety and feasibility for clinical application of poly (l-lactic acid/ε-caprolactone) [P (LA/CL)] membrane, a novel biodegradable synthetic material used for GBR. Patients who required horizontal bone augmentation (≥3 mm implant exposure) for implant treatment were included in the study. P (LA/CL) membrane was used simultaneously with implant placement to achieve bone augmentation by GBR. The occurrence of adverse events was assessed until the follow-up period of a second surgical procedure. The amount of bone augmentation was assessed by means of cone-beam computed tomography, and implant stability was assessed by measuring the implant stability quotient (ISQ). Student's t-test was used and the level of significance was set at p < 0.05. This first-in-human study comprised five participants. Adverse events were observed in three of five patients, and a cause-and-effect relationship of the membrane could not be denied in one of them. Good bone formation was observed in the GBR region of all five patients. The ISQ during the second surgical procedure indicated good osseointegration in all the patients. The application of P (LA/CL) membrane for bone augmentation with GBR made it possible to maintain the augmented bone volume without causing any irreversible adverse events. However, further investigations on humans are required to confirm the safety of this biomaterial.","",""
0,"Yiruo He, Ye Tian, Wenjie Zhang, Xinghai Wang, Xue Yang, Bin Li, Liming Ge, Ding Bai, Defu Li","Fabrication of oxidized sodium alginate-collagen heterogeneous bilayer barrier membrane with osteogenesis-promoting ability",2022,"International journal of biological macromolecules","","","",121,"2026-01-24 10:23:41","Journal Article","10.1016/j.ijbiomac.2021.12.155","1879-0003",,202,,55,67,0,0.00,0,9,4,"Guided bone regeneration technique is an effective approach to repair bone defects, in which a barrier membrane is essential. However, the collagen barrier membranes commonly used lose stability quickly, leading to connective tissue invasion and failure of osteogenesis. Herein, we presented an oxidized sodium alginate (OSA)-collagen heterogeneous bilayer barrier membrane with well-controlled pore size and osteogenesis-promoting ability. The OSA crosslinking significantly improved the structural stability, compressive strength, swelling behavior, and slowed down the biodegradation rate of collagen membranes. Meanwhile, the collagen-based membranes exhibited superior cytocompatibility, osteogenesis-promotion, and barrier function against fibroblasts. Especially, the osteogenic differentiation was most promoted on the membrane with a large pore size (240-310 μm), while the barrier function was most improved on the membrane with a small pore size (30-60 μm). Then the above two membranes were combined together to obtain a heterogeneous bilayer membrane. This bilayer barrier membrane showed excellent osteogenesis-promoting ability in rats.","",""
0,"He Liang, Jie Yin, Kenny Man, Xuebin B Yang, Elena Calciolari, Nikolaos Donos, Stephen J Russell, David J Wood, Giuseppe Tronci","A long-lasting guided bone regeneration membrane from sequentially functionalised photoactive atelocollagen",2022,"Acta biomaterialia","","","",122,"2026-01-24 10:23:41","Journal Article","10.1016/j.actbio.2021.12.004","1878-7568",,140,,190,205,0,0.00,0,9,4,"The fast degradation of collagen-based membranes in the biological environment remains a critical challenge, resulting in underperforming Guided Bone Regeneration (GBR) therapy leading to compromised clinical results. Photoactive atelocollagen (AC) systems functionalised with ethylenically unsaturated monomers, such as 4-vinylbenzyl chloride (4VBC), have been shown to generate mechanically competent materials for wound healing, inflammation control and drug delivery, whereby control of the molecular architecture of the AC network is key. Building on this platform, the sequential functionalisation with 4VBC and methacrylic anhydride (MA) was hypothesised to generate UV-cured AC hydrogels with reduced swelling ratio, increased proteolytic stability and barrier functionality for GBR therapy. The sequentially functionalised atelocollagen precursor (SAP) was characterised via TNBS and ninhydrin colourimetric assays, circular dichroism and UV-curing rheometry, which confirmed nearly complete consumption of collagen's primary amino groups, preserved triple helices and fast (< 180 s) gelation kinetics, respectively. Hydrogel's swelling ratio and compression modulus were adjusted depending on the aqueous environment used for UV-curing, whilst the sequential functionalisation of AC successfully generated hydrogels with superior proteolytic stability in vitro compared to both 4VBC-functionalised control and the commercial dental membrane Bio-Gide®. These in vitro results were confirmed in vivo via both subcutaneous implantation and a proof-of-concept study in a GBR calvarial model, indicating integrity of the hydrogel and barrier defect, as well as tissue formation following 1-month implantation in rats. STATEMENT OF SIGNIFICANCE: Collagen-based membranes remain a key component in Guided Bone Regeneration (GBR) therapy, but their properties, e.g. proteolytic stability and soft tissue barrier functionality, are still far from optimal. This is largely attributed to the complex molecular configuration of collagen, which makes chemical accessibility and structure-function relations challenging. Here, we fabricated a UV-cured hydrogel network of atelocollagen, whereby triple helices were sequentially functionalised with two distinct ethylenically unsaturated monomers. The effects of the sequential functionalisation and UV-curing on the macroscopic properties, degradation behaviour and GBR capability were investigated in vitro and in vivo. The results highlight the key role of the sequential functionalisation and provide important insights for the design of future, longer-lasting resorbable membranes for GBR therapy.","",""
0,"Ole Jung, Bernhard Hesse, Sanja Stojanovic, Christian Seim, Timm Weitkamp, Milijana Batinic, Oliver Goerke, Željka Perić Kačarević, Patrick Rider, Stevo Najman, Mike Barbeck","Biocompatibility Analyses of HF-Passivated Magnesium Screws for Guided Bone Regeneration (GBR)",2021,"International journal of molecular sciences","","","",123,"2026-01-24 10:23:41","Journal Article","10.3390/ijms222212567","1422-0067",,22,22,,,0,0.00,0,11,5,"Background: Magnesium (Mg) is one of the most promising materials for human use in surgery due to material characteristics such as its elastic modulus as well as its resorbable and regenerative properties. In this study, HF-coated and uncoated novel bioresorbable magnesium fixation screws for maxillofacial and dental surgical applications were investigated in vitro and in vivo to evaluate the biocompatibility of the HF coating. Methods: Mg alloy screws that had either undergone a surface treatment with hydrofluoric-acid (HF) or left untreated were investigated. In vitro investigation included XTT, BrdU and LDH in accordance with the DIN ISO 10993-5/-12. In vivo, the screws were implanted into the tibia of rabbits. After 3 and 6 weeks, degradation, local tissue reactions and bony integration were analyzed histopathologically and histomorphometrically. Additionally, SEM/EDX analysis and synchrotron phase-contrast microtomography (µCT) measurements were conducted. The in vitro analyses revealed that the Mg screws are cytocompatible, with improved results when the surface had been passivated with HF. In vivo, the HF-treated Mg screws implanted showed a reduction in gas formation, slower biodegradation and a better bony integration in comparison to the untreated Mg screws. Histopathologically, the HF-passivated screws induced a layer of macrophages as part of its biodegradation process, whereas the untreated screws caused a slight fibrous tissue reaction. SEM/EDX analysis showed that both screws formed a similar layer of calcium phosphates on their surfaces and were surrounded by bone. Furthermore, the µCT revealed the presence of a metallic core of the screws, a faster absorbing corrosion front and a slow absorbing region of corroded magnesium. Conclusions: Overall, the HF-passivated Mg fixation screws showed significantly better biocompatibility in vitro and in vivo compared to the untreated screws.","",""
