Cites,Authors,Title,Year,Source,Publisher,ArticleURL,CitesURL,GSRank,QueryDate,Type,DOI,ISSN,CitationURL,Volume,Issue,StartPage,EndPage,ECC,CitesPerYear,CitesPerAuthor,AuthorCount,Age,Abstract,FullTextURL,RelatedURL
0,"Heba S Zayed, Safaa Saleh, Areg E Omar, Ahmed K Saleh, Ahmed Salama, Emad Tolba","Development of collagen-chitosan dressing gel functionalized with propolis-zinc oxide nanoarchitectonics to accelerate wound healing",2024,"International journal of biological macromolecules","","","",34,"2026-01-24 10:13:04","Journal Article","10.1016/j.ijbiomac.2024.129665","1879-0003",,261,,129665,,0,0.00,0,6,2,"Using an in situ sol-gel technique, new nanoarchitectonics of propolis loaded zinc oxide nanoarchitectonics (PP/ZnO-NPs) were developed in order to improve the in vivo outcomes of collagen-chitosan gel in wounded rats. The obtained nanoarchitectonics were fully characterized. The XRD results indicate the presence of a Zincite phase for ZnO-NPs and Zincite accompanied by a minor amount of zinc hydroxide for PP/ZnO-NPs samples. While the TEM findings illustrate the transfer of the ZnO-NPs from agglomerated spheres with an average particle size of 230 ± 29 nm to needle-like NPs of 323 ± 173 nm length (PP1/ZnO-NPs) and to a sheet-like NPs of 500 ± 173 nm diameter (PP2/ZnO-NPs). In addition, the incorporation of PP results in an increase in the surface negativity of ZnO-NPs to -31.4 ± 6.4 mV for PP2/ZnO-NPs. The antimicrobial activities of the nanocomposite gel loaded with 10%PP1/ZnO-NPs (G6) revealed the highest inhibition zone against E. coli (26 ± 2.31 mm). Remarkably, the in vivo outcomes showed that the nanocomposite gel (G6) has exceptional collagen deposition, quick wound closure rates, and re-epithelization. The outcomes demonstrate the nanocomposite gel encouraging biological properties for the treatment of damaged and infected wounds.","",""
0,"Eugenia Rendueles, Elba Mauriz, Javier Sanz-Gómez, Ana M González-Paramás, María-E Vallejo-Pascual, Félix Adanero-Jorge, Camino García-Fernández","Biochemical Profile and Antioxidant Properties of Propolis from Northern Spain",2023,"Foods (Basel, Switzerland)","","","",35,"2026-01-24 10:13:04","Journal Article","10.3390/foods12234337","2304-8158",,12,23,,,0,0.00,0,7,3,"The antioxidant, anti-inflammatory, and antimicrobial characteristics of propolis, a bioactive compound collected from hives, have prompted its use in the food sector in recent times. This study investigated the physicochemical characteristics, phenolic profile, and antioxidant capacity of 31 propolis extracts collected from Northern Spain. The physicochemical composition (resins, waxes, ashes mineral content, and heavy metals) was within the allowable regulatory limits. The analysis of bioactive compounds enabled the identification of 51 constituents: flavonoids (apigenin, catechin, chrysin, quercetin, and pinocembrin) and phenolic acids (caffeic, ferulic, and coumaric). The mean value of total polyphenols was 42.72 ± 13.19 Pinocembrin-Galangin Equivalents/100 g, whereas a range between 1.64 ± 0.04 and 4.95 ± 0.36 Quercetin Equivalents (QE) g/100 g was found for total flavonoids content. The determination of bioactivities revealed significant antioxidant capacity using DPPH (1114.28 ± 10.39 µM Trolox Equivalents and 3487.61 ± 318.66 µM Vitamin C Equivalents). Resin content in propolis samples was positively and significantly correlated with both polyphenols (rho = 0.365; p = 0.043) and flavonoid composition (rho = 0.615; p = 0.000) as well as the antioxidant capacity TEAC DPPH (rho = 0.415; p = 0.020). A multiple regression analysis modeled the correlation between resin composition, flavonoids, and TEAC DPPH values, yielding a significant regression equation (R2 = 0.618; F (2,28) = 22.629; p < 0.000; d = 2.299). Therefore, evaluating physicochemical parameters and biological activities provides a promising framework for predicting propolis' quality and antioxidant properties, thus suggesting its potential as a functional and bioactive compound for the food industry.","",""
0,"Gabriela Mădălina Oprică, Denis Mihaela Panaitescu, Brînduşa Elena Lixandru, Catalina Diana Uşurelu, Augusta Raluca Gabor, Cristian-Andi Nicolae, Radu Claudiu Fierascu, Adriana Nicoleta Frone","Plant-Derived Nanocellulose with Antibacterial Activity for Wound Healing Dressing",2023,"Pharmaceutics","","","",36,"2026-01-24 10:13:04","Journal Article","10.3390/pharmaceutics15122672","1999-4923",,15,12,,,0,0.00,0,8,3,"The medical sector is one of the biggest consumers of single-use materials, and while the insurance of sterile media is non-negotiable, the environmental aspect is a chronic problem. Nanocellulose (NC) is one of the safest and most promising materials that can be used in medical applications due to its valuable properties like biocompatibility and biodegradability, along with its good mechanical properties and high water uptake capacity. However, NC has no bactericidal activity, which is a critical need for the effective prevention of infections in chronic diabetic wound dressing applications. Therefore, in this work, a natural product, propolis extract (PE), was used as an antibacterial agent, in different amounts, together with NC to obtain sponge-like structures (NC/PE). The scanning electron microscope (SEM) images showed well-impregnated cellulose fibers and a more compact structure with the addition of PE. According to the thermogravimetric analysis (TGA), the samples containing PE underwent thermal degradation before the unmodified NC due to the presence of volatile compounds in the extract. However, the peak degradation temperature in the first derivative thermogravimetric curves was higher for all the sponges containing PE when compared to the unmodified NC. The antibacterial efficacy of the samples was tested against Staphylococcus aureus, Pseudomonas aeruginosa, and Escherichia coli, as well as on two clinically resistant isolates. The samples completely inhibited the development of Staphylococcus aureus, and Pseudomonas aeruginosa was partially inhibited, while Escherichia coli was resistant to the PE action. Considering the physical and biological properties along with the environmental and economic benefits, the development of an NC/PE wound dressing seems promising.","",""
0,"Catarina Passão, Cristina Almeida-Aguiar, Ana Cunha","Modelling the In Vitro Growth of Phytopathogenic Filamentous Fungi and Oomycetes: The Gompertz Parameters as Robust Indicators of Propolis Antifungal Action",2023,"Journal of fungi (Basel, Switzerland)","","","",37,"2026-01-24 10:13:04","Journal Article","10.3390/jof9121161","2309-608X",,9,12,,,0,0.00,0,3,3,"Propolis is a resinous mixture produced by honeybees, mainly from plant exudates. With a rich chemical composition including many phenolic compounds, mostly responsible for its biological properties, namely antimicrobial ones, propolis may be a promising alternative to synthetic pesticides. The study of propolis from the south of Portugal and of its potential against phytopathogenic agents are still very recent and different methodological approaches hinder a comparison of efficacies. In this context, we aimed to test the value of a mathematical model for the multiparametric characterization of propolis' antifungal action on solid medium assays. An ethanol extract (EE) of a propolis sample harvested in 2016 from Alves (A16) was characterized in terms of phenolic composition and antimicrobial potential against five phytopathogenic species. A16.EE (500-2000 µg/mL) inhibited the mycelial growth of all the species, with Phytophthora cinnamomi and Biscogniauxia mediterranea being the most susceptible and Colletotrichum acutatum being the least affected. The Gompertz mathematical model proved to be a suitable tool for quantitatively describing the growth profiles of fungi and oomycetes, and its parameters exhibit a high level of discrimination. Our results reveal that propolis extracts may have potential applications beyond traditional uses, particularly within the agri-food sector, allowing beekeepers to make their businesses more profitable and diversified.","",""
0,"Nair Silva Macêdo, Zildene de Sousa Silveira, Ângella Eduarda da Silva Sousa, Débora Menezes Dantas, Amanda Lins Bispo Monteiro, Helcio Silva Dos Santos, Francisco Assis Bezerra da Cunha","Floral Visitation, Phytochemical and Biological Activities of Bioproducts from Tetragonisca angustula (Hymenoptera, Apidae, Meliponini): A Review",2023,"Chemistry & biodiversity","","","",38,"2026-01-24 10:13:04","Journal Article","10.1002/cbdv.202301451","1612-1880",,20,12,,,0,0.00,0,7,3,"Tetragonisca angustula (Latreille, 1811) is an indigenous neotropical stingless bee, popularly known as ""Jataí"", with a wide distribution in the Brazilian territory. T. angustula produces other derivatives such as propolis, geopropolis, fermented (saburá pollen), cerumen and resins, which are important in folk medicine. In this review, the objective was to gather research on the main plant species visited by T. angustula, as well as studies that verified the chemical composition and biological properties of T. angustula bioproducts. The bibliographic review was performed by searching the Scopus, Web of Science, ScienceDirect, and PubMed databases for publications from 2003 to February 2023. We found 78 studies that analyzed the interactions between T. angustula and floral species, with species from the botanical families Fabaceae, Asteraceae, Malvaceae, Bignoniaceae, Solanaceae, Myrtaceae and Lamiaceae being the most reported as the main food sources for this species. The presence of compounds belonging to the class of flavonoids, phenolic acids, terpenoids and alkaloids has been identified by studying the chemical composition of honey, propolis, geopropolis and fermented pollen (saburá) in 21 studies. The data collected in the literature emphasize that these T. angustula products have remarkable biological properties, especially their antibacterial and antioxidant activities.","",""
0,"Fatemeh Shahab-Navaei, Ahmad Asoodeh","Synthesis of optimized propolis solid lipid nanoparticles with desirable antimicrobial, antioxidant, and anti-cancer properties",2023,"Scientific reports","","","",39,"2026-01-24 10:13:04","Journal Article","10.1038/s41598-023-45768-y","2045-2322",,13,1,18290,,0,0.00,0,2,3,"This study aimed to produce stable propolis nanoparticles with a size below 100 nm, suitable for various applications in industries such as pharmaceuticals, medicine, cosmetics, food, and packaging. To achieve this, propolis solid lipid nanoparticles (PSLNs) were synthesized using the hot homogenization method, and the optimized nanoparticles were analyzed using Design Expert software. The properties of the synthesized PSLN were characterized using UV-visible spectroscopy, FTIR, XRD, PSA, TEM, and zeta potential analysis. The results indicated that PSLNs with a size range of 57 ± 15 nm remained stable in an aqueous medium at pH 7.4. HPLC analysis showed that the active ingredient of phenols and flavonoids in the extract remained stable after the formation of PSLNs. Antioxidant and antibacterial properties of the extract and nanoparticles were also evaluated. The results demonstrated that the biological properties of the extract were effectively preserved in PSLNs, Additionally, the PSLN synthesized exhibited remarkable anticancer properties against the A549 cell line and with IC50 of 0.01 mg/ml after 72 h-treatment. In conclusion, the optimized PSLNs can be utilized as antioxidant and antibacterial additives and have the potential to be used as a drug or drug carrier for the treatment of lung cancer.","",""
0,"Fernanda Wariss Figueiredo Bezerra, Jonilson de Melo E Silva, Gustavo Guadagnucci Fontanari, Johnatt Allan Rocha de Oliveira, Mahendra Rai, Renan Campos Chisté, Luiza Helena da Silva Martins","Sustainable Applications of Nanopropolis to Combat Foodborne Illnesses",2023,"Molecules (Basel, Switzerland)","","","",40,"2026-01-24 10:13:04","Journal Article","10.3390/molecules28196785","1420-3049",,28,19,,,0,0.00,0,7,3,"Propolis has numerous biological properties and technological potential, but its low solubility in water makes its use quite difficult. With the advent of nanotechnology, better formulations with propolis, such as nanopropolis, can be achieved to improve its properties. Nanopropolis is a natural nanomaterial with several applications, including in the maintenance of food quality. Food safety is a global public health concern since food matrices are highly susceptible to contamination of various natures, leading to food loss and transmission of harmful foodborne illness. Due to their smaller size, propolis nanoparticles are more readily absorbed by the body and have higher antibacterial and antifungal activities than common propolis. This review aims to understand whether using propolis with nanotechnology can help preserve food and prevent foodborne illness. Nanotechnology applied to propolis formulations proved to be effective against pathogenic microorganisms of industrial interest, making it possible to solve problems of outbreaks that can occur through food.","",""
0,"Azza A Amin, Khaled F Mahmoud, Manal F Salama, Vincenzo Longo, Luisa Pozzo, Effat I Seliem, Mona A Ibrahim","Characterization and stability evaluation of Egyptian propolis extract nano-capsules and their application",2023,"Scientific reports","","","",41,"2026-01-24 10:13:04","Journal Article","10.1038/s41598-023-42025-0","2045-2322",,13,1,16065,,0,0.00,0,7,3,"The increasing demand for natural products and biotechnological activities from bees facilitate their widespread use in food preservation and beneficial effects on humans. This study aimed to prepare and characterize the nano-capsules of Qaluiobia (PQG) governorates propolis extracted with water, ethanol and supercritical fluid-carbon dioxide at 50 °C with co-solvent. Propolis bioavailability was analyzed and introduced to prepare crackers to extend their shelf life. Nano-encapsulation was examined using transmission electron microscopy (TEM), differential scanning calorimetry (DSC) and antioxidant activity. Ethanol and supercritical fluid-carbon dioxide (SCF-CO2) at 50 °C with ethanol as co-solvent recorded higher yield, antioxidant activities, total phenolics and total flavonoids. SCF-CO2 extracts had a higher flavonoid concentration. It was revealed that propolis nano-capsules had high-temperature stability and cytotoxic effects against the three tested human cancer cell lines (i.e. PC3, MCF7 and HePG2). The higher overall acceptability of crackers fortified with PQG was achieved with SCF-CO2 at 50 °C and ethanol extract nano-capsules, i.e. 86.57% and 86.29% respectively. The higher ability to retain antioxidant activity reduces the increase of peroxide value (PV), preventing rancidity and increasing the shelf life of crackers during the storage period. Practical application: This study can provide a suitable method for extracting bioactive compounds from propolis, and improve the biological properties and activities by nano-encapsulation, also reveals the extent of its use as a natural antioxidant and anticancer and its application in bakery products as a functional food.","",""
0,"Emanuele Joana Gbur Laureanti, Thainnane Silva Paiva, Luiz Mário de Matos Jorge, Regina Maria Matos Jorge","Microencapsulation of bioactive compound extracts using maltodextrin and gum arabic by spray and freeze-drying techniques",2023,"International journal of biological macromolecules","","","",42,"2026-01-24 10:13:04","Journal Article","10.1016/j.ijbiomac.2023.126969","1879-0003",,253,,126969,,0,0.00,0,4,3,"Microencapsulation techniques establish a protective barrier around a sensitive compound, reducing vulnerability to external influences and offering controlled release. This work evaluates microencapsulation of Brazilian seed known as pink pepper (Schinus terebinthifolius) extract incorporated with green propolis extract, (main propolis font from the South America native plant Baccharis dracunculifolia DC) to enhancement antioxidant activity through synergic interaction, comparing to the extracts individually. Four treatments were produced using maltodextrin and combined with gum arabic as encapsulating agent, employing two different microencapsulation technique applied (spray drying and freeze drying) to assess their impact on physicochemical properties. The incorporation of gum arabic into matrix yielded higher encapsulation efficiency values, exhibiting significant differences for both encapsulation techniques. Combining the two encapsulation agents afforded greater protection of the bioactive compounds, resulting in an increase of approximately 31 % in the inhibition of the DPPH● radical. In controlled release analysis, maltodextrin exhibits the best protective effect on total phenolic compounds during intestinal release, whereas combining maltodextrin and gum arabic enhanced protection during gastric phase. Microcapsules may contribute to the protection of important bioactive compound, possessing a wide range of applications such as flavors encapsulation in food industry, lipids, antioxidants and pharmaceutical industry for controlled drug release.","",""
0,"Seyedeh-Sara Hashemi, Ali Akbar Mohammadi, Seyedeh-Somayeh Rajabi, Parisa Sanati, Alireza Rafati, Mehdi Kian, Zahra Zarei","Preparation and evaluation of a polycaprolactone/chitosan/propolis fibrous nanocomposite scaffold as a tissue engineering skin substitute",2023,"BioImpacts : BI","","","",43,"2026-01-24 10:13:04","Journal Article","10.34172/bi.2023.26317","2228-5652",,13,4,275,287,0,0.00,0,7,3,"Recently, the application of nanofibrous mats for dressing skin wounds has received great attention. In this study, we aimed to fabricate and characterize an electrospun nanofibrous mat containing polycaprolactone (PCL), chitosan (CTS), and propolis for use as a tissue-engineered skin substitute. Raw propolis was extracted, and its phenolic and flavonoid contents were measured. The physiochemical and biological properties of the fabricated mats, including PCL, PCL/CTS, and PCL/CTS/Propolis were evaluated by scanning electron microscopy (SEM), atomic force microscopy (AFM), mechanical analysis, swelling and degradation behaviors, contact angle measurement, cell attachment, DAPI staining, and MTT assay. On the other hand, the drug release pattern of propolis from the PCL/CTS/Propolis scaffold was determined. A deep second-degree burn wound model was induced in rats to investigate wound healing using macroscopical and histopathological evaluations. The results revealed that the propolis extract contained high amounts of phenolic and flavonoid compounds. The fabricated scaffold had suitable physicochemical and mechanical properties. Uniform, bead-free, and well-branched fibers were observed in SEM images of mats. AFM analysis indicated that the addition of CTS and propolis to PCL elevated the surface roughness. MTT results revealed that the electrospun PCL/CTS/Propolis mat was biocompatible. The presence of fibroblast cells on the PCL/CTS/Propolis mats was confirmed by DAPI staining and SEM images. Also, propolis was sustainably released from the PCL/CTS/Propolis mat. The animal study revealed that addition of propolis significantly improved wound healing. The nanofibrous PCL/CTS/Propolis mat can be applied as a tissue-engineered skin substitute for healing cutaneous wounds, such as burn wounds.","",""
0,"Rebeca Pérez, Viviana Burgos, Víctor Marín, Antoni Camins, Jordi Olloquequi, Iván González-Chavarría, Henning Ulrich, Ursula Wyneke, Alejandro Luarte, Leandro Ortiz, Cristian Paz","Caffeic Acid Phenethyl Ester (CAPE): Biosynthesis, Derivatives and Formulations with Neuroprotective Activities",2023,"Antioxidants (Basel, Switzerland)","","","",45,"2026-01-24 10:13:04","Journal Article","10.3390/antiox12081500","2076-3921",,12,8,,,0,0.00,0,11,3,"Neurodegenerative disorders are characterized by a progressive process of degeneration and neuronal death, where oxidative stress and neuroinflammation are key factors that contribute to the progression of these diseases. Therefore, two major pathways involved in these pathologies have been proposed as relevant therapeutic targets: The nuclear transcription factor erythroid 2 (Nrf2), which responds to oxidative stress with cytoprotecting activity; and the nuclear factor NF-κB pathway, which is highly related to the neuroinflammatory process by promoting cytokine expression. Caffeic acid phenethyl ester (CAPE) is a phenylpropanoid naturally found in propolis that shows important biological activities, including neuroprotective activity by modulating the Nrf2 and NF-κB pathways, promoting antioxidant enzyme expression and inhibition of proinflammatory cytokine expression. Its simple chemical structure has inspired the synthesis of many derivatives, with aliphatic and/or aromatic moieties, some of which have improved the biological properties. Moreover, new drug delivery systems increase the bioavailability of these compounds in vivo, allowing its transcytosis through the blood-brain barrier, thus protecting brain cells from the increased inflammatory status associated to neurodegenerative and psychiatric disorders. This review summarizes the biosynthesis and chemical synthesis of CAPE derivatives, their miscellaneous activities, and relevant studies (from 2010 to 2023), addressing their neuroprotective activity in vitro and in vivo.","",""
0,"Tábata Rodrigues Esperandim, Arthur Barcelos Ribeiro, Iara Silva Squarisi, Letícia Teixeira Marcos de Souza, Thiago Olimpio de Souza, Nathália Oliveira Acésio, Mário Ferreira Conceição Santos, Jairo Kenupp Bastos, Sérgio Ricardo Ambrósio, Denise Crispim Tavares","Toxicological and chemoprevention studies of Brazilian brown propolis from Araucaria sp",2023,"Journal of toxicology and environmental health. Part A","","","",46,"2026-01-24 10:13:04","Journal Article","10.1080/15287394.2023.2243976","2381-3504",,86,21,791,802,0,0.00,0,10,3,"Brazilian brown propolis (BBP) is a natural product derived predominantly from the south region of Brazil, where Araucaria forests are dominant. Despite its potential as a source of bioactive compounds with leishmanicidal, anti-inflammatory, nociceptive, and antimicrobial properties, BBP has not been comprehensively studied compared to green propolis. Therefore, this study aimed to determine the safety and chemopreventive potential of BBP. The cytotoxicity attributed to BBP was assessed using two different assays, while the Salmonella/microsome assay was employed to evaluate mutagenicity. The acute toxicity attributed to BBP was determined using a zebrafish model, while the chemopreventive potential was investigated utilizing Chinese hamster lung (V79) cell lines. Data demonstrated that BBP exerted cytotoxic effects at concentrations greater than or equal to 10 µg/ml and did not exhibit mutagenicity in Salmonella typhimurium strains TA98 and TA100. However, at the highest concentration tested (4000 µg/plate), BBP induced a significant increase in revertant colonies in S. typhimurium TA102 strain. The LC50 equivalent to 8.83 mg/L was obtained in the acute toxicity evaluation in zebrafish. BBP also showed antigenotoxic effect by significantly reducing chromosomal damage induced by the mutagen doxorubicin in V79 cell cultures at a concentration of 2.5 μg/ml. Compared to Brazilian green and red propolis, BBP exhibited greater toxicity. On the other hand, at lower concentrations, BBP displayed chemopreventive potential, which may be associated with the antioxidant capacity of the extract. These findings contribute to a better understanding of the biological properties and potential applications of BBP in treating various diseases.","",""
