Cites,Authors,Title,Year,Source,Publisher,ArticleURL,CitesURL,GSRank,QueryDate,Type,DOI,ISSN,CitationURL,Volume,Issue,StartPage,EndPage,ECC,CitesPerYear,CitesPerAuthor,AuthorCount,Age,Abstract,FullTextURL,RelatedURL
0,"Dae-Ho Park, Jong-Hun Jun, Seo-Hyoung Yun, Baek-Sun Choi, Joseph P Fiorellini, Marco Tallarico, Kyung-Gyun Hwang, Chang-Joo Park","Semi-customized three-dimensional ultra-fine titanium meshes in guided bone regeneration for implant therapy in severe alveolar bone defect: a case report",2024,"International journal of implant dentistry","","","",62,"2026-01-24 10:23:41","Case Reports","10.1186/s40729-024-00535-0","2198-4034",,10,1,17,,0,0.00,0,8,2,"This case report provides a detailed description of a simple and fast bone regeneration procedure using a semi-customized three-dimensional ultra-fine titanium mesh. A 50-year-old male with a severe vertical and horizontal bone defect in the anterior mandible underwent implant treatment in a staged approach. The autologous bone was combined with a xenograft, and the mixture was grafted to augment the bone defect and covered with semi-customized ultra-fine titanium meshes, which were selected among its various types according to size and configuration of the bone defect, directly connected and immobilized on the tenting screws with minimal shaping. In a postoperative 6 months re-entry surgery, the performed titanium meshes were removed, implants were placed, and a bone core biopsy was obtained that demonstrated satisfactory new bone formation. Finally, two months later, the definitive prosthesis was installed. This semi-customized ultra-fine titanium mesh could help an implant clinician obtain more predictable results in the guided bone regeneration (GBR).","",""
0,"William E Bane, Gary M Blyleven, Adam R Lincicum, Brian W Stancoven, Kimberly A Inouye, Thomas M Johnson","The nasal spine suture: A novel approach for membrane stabilization",2024,"Clinical advances in periodontics","","","",63,"2026-01-24 10:23:41","Case Reports","10.1002/cap.10279","2163-0097",,14,4,300,309,0,0.00,0,6,2,"Current evidence acknowledges guided bone regeneration (GBR) as a predictable therapeutic modality in the augmentation of a deficient alveolar ridge. Such deficiencies often reveal inadequate bone volume to support implant placement in a position amenable to prosthetic reconstruction. Additionally, an evolving body of literature demonstrates that membrane fixation may lead to improved clinical bone gain through positively influencing blood clot formation, stability, and the eventual osteogenic potential of the defect. Alternative benefits to membrane fixation, such as reduced graft displacement and reduction in wound micromotion, have also been cited as mechanisms for an increased regenerative response. The aim of this report was to present a case, including diagnosis, treatment, and follow-up for the reconstruction of a horizontal ridge deficiency. The patient's deficiency in ridge volume was found to be a developmental sequelae of lateral incisor agenesis, resulting in an underdeveloped midfacial region of the alveolar process subjacent to sites #7 and #10. The fixation protocol outlined in this report demonstrated adequate horizontal ridge augmentation to facilitate future prosthetic reconstruction with the use of implants. Numerous protocols have been established in an attempt to achieve effective barrier membrane stabilization for bone augmentation procedures. However, some techniques are poorly suited for the anatomically challenging region of the anterior maxilla. A case report describing the utilization of the anterior nasal spine for anchorage of a membrane-stabilizing suture may present a novel, safe, and effective technique for stabilizing the intended region of augmentation, as well as preventing graft migration beyond the membrane-maxilla interface. Key points Regarding guided bone regeneration (GBR) procedures, micromotion of the membrane or of the underlying particulate graft may negatively influence the volume of the augmented site. The ability to adequately stabilize the graft-membrane interface is recognized as a necessary prerequisite to predictably achieve optimal surgical outcomes. To the authors' knowledge, there is no clinical or scientific evidence regarding the use of the anterior nasal spine for membrane anchorage in maxillary GBR procedures, and thus a novel approach to membrane stabilization is introduced.","",""
0,"Won-Bae Park, Min-Soo Bae, Wonhee Park, Hyun-Chang Lim, Ji-Young Han","A Novel Approach for the Treatment of Recurrent Oroantral Fistula Occurring at an Infected Sinus Augmentation Site",2024,"Medicina (Kaunas, Lithuania)","","","",64,"2026-01-24 10:23:41","Case Reports","10.3390/medicina60020343","1648-9144",,60,2,,,0,0.00,0,5,2,"Closing a recurrent oroantral fistula (OAF) that occurs at an infected sinus augmentation site is a challenge for clinicians. The recurrent OAF has a detrimental impact on bone regeneration and subsequent implant placement. This case report includes three cases in which sinus graft infection and OAF occurred after maxillary sinus augmentation (MSA). In these cases, treatments to control sinus infection were performed using an otolaryngologist; then, intraoral interventions comprising mucosal flap procedures, bone grafts, and barrier membrane applications were performed 2-5 times by oral surgeons. Nevertheless, OAF recurred persistently. The failure to stop OAF recurrence may be due to the inability to effectively block air pressure at the OAF site. Following a comprehensive debridement of the infected tissue at the previous sinus augmentation site, a pouch was created through sinus mucosal elevation. The perforated sinus mucosa at the OAF site was covered with a non-resorbable membrane in one case and with resorbable collagen membranes in the other two cases, followed by bone grafting within the pouch. Lastly, this procedure was completed by blocking the entrance of the pouch with a cortical bone shell graft and a resorbable collagen membrane. The cortical bone shell graft, obstructing the air pressure from the nasal cavity, facilitated bone formation, and, ultimately, allowed for implant placement. Within the limitations of the present case report, the application of a guided bone regeneration technique involving a cortical bone shell graft and a barrier membrane enabled the closure of the recurrent OAF and subsequent implant placement.","",""
0,"Dong-Seok Sohn, Albert Lui, Hyunsuk Choi","Utilization of Tenting Pole Abutments for the Reconstruction of Severely Resorbed Alveolar Bone: Technical Considerations and Case Series Reports",2024,"Journal of clinical medicine","","","",65,"2026-01-24 10:23:41","Case Reports","10.3390/jcm13041156","2077-0383",,13,4,,,0,0.00,0,3,2,"Although various surgical techniques have been utilized in the reconstruction of severely resorbed alveolar bone, its regeneration is still regarded as a major challenge. Most of the surgical techniques used in advanced ridge augmentation have the disadvantages of prolonging the patient's edentulous healing and increasing the need for surgical revisits because simultaneous implant placement is not allowed. This report presents a new and simplified method for advanced ridge augmentation, which utilizes a vertical tenting device. The first case presented the reconstruction of the mandibular posterior region with severely resorbed alveolar bone due to peri-implantitis using tenting pole abutment for ridge augmentation. The second and third cases presented three-dimensional ridge augmentations in severely resorbed ridges due to periodontitis. The last case presented horizontal ridge augmentation using a vertical tenting device. All cases were performed under local anesthesia. Implants were simultaneously placed in the bone defect area. A vertical tensioning device was then connected to the implant platform to minimize the collapse of the bone graft during the bone regeneration period due to the contraction of the soft tissue matrix. A sticky bone graft was transplanted onto the exposed surface of the implant and on top of the vertical tensioning device. After covering with an absorbable barrier membrane, the soft tissues were sutured without tension. In all cases, prosthetic restorations were provided to patients after a bone grafting period of 5-6 months, leading to a rapid restoration of masticatory function. Results tracked for up to 6 years revealed observed stable reconstruction of the alveolar bone. The use of a vertical tenting device can prevent the collapse of biomaterials in the augmented ridge during the healing period, leading to predictable outcomes when achieving three-dimensional ridge augmentation.","",""
0,"Ahmed M Kabli","The Effectiveness of Subepithelial Connective Tissue Graft as a Barrier Membrane in Guided Bone Regeneration: A Case Report",2023,"Cureus","","","",71,"2026-01-24 10:23:41","Case Reports","10.7759/cureus.48741","2168-8184",,15,11,,,0,0.00,0,1,3,"Subepithelial connective tissue graft (SCTG) can be used as a membrane in guided bone regeneration (GBR) to gain more tissue volume. The case presents a 66-year-old female patient with a missing canine and is referred for dental implant placement. The implant was placed; GBR was done using xenograft particulate and a palatal SCTG as a membrane to improve the labial contour and achieve better esthetics. She returned for a routine follow-up after 14 months, and the examination revealed a well-maintained tissue contour following the final crown placement.","",""
0,"Daniel Palkovics, Patrick Rider, Svenja Rogge, Željka Perić Kačarević, Peter Windisch","Possible Applications for a Biodegradable Magnesium Membrane in Alveolar Ridge Augmentation-Retrospective Case Report with Two Years of Follow-Up",2023,"Medicina (Kaunas, Lithuania)","","","",74,"2026-01-24 10:23:41","Case Reports","10.3390/medicina59101698","1648-9144",,59,10,,,0,0.00,0,5,3,"Background and Objectives: A rigid, resorbable magnesium membrane was recently developed, combining the advantages of resorbable and non-resorbable membranes. Our aim was to describe the application of this membrane for guided bone regeneration (GBR). Materials and Methods: This case report described the treatment and 3D evaluation of two cases utilizing a resorbable magnesium barrier membrane. In Case #1, GBR was performed with a bilayer tunnel flap. The magnesium barrier was placed fixed subperiosteally through remote vertical incisions. In Case #2, GBR was performed using a split-thickness flap design. Volumetric and linear hard tissue alterations were assessed by 3D cone-beam computed tomography subtraction analysis, as well as with conventional intraoral radiography. Results: Case #1 showed a volumetric hard tissue gain of 0.12 cm3, whereas Case #2 presented a 0.36 cm3 hard tissue gain. No marginal peri-implant hard tissue loss could be detected at the two-year follow-up. Conclusions: The application of conventional resorbable collagen membranes would be difficult in either of the cases presented. However, the rigid structure of the magnesium membrane allowed for the limitations of conventional resorbable membranes to be overcome.","",""
0,"Behzad Houshmand, Mohammadreza Talebi Ardakani, Omid Amirinasab, Reza Amid, Anahita Moscowchi, Zeinab Rezaei Esfahrood, Mehdi Ekhlasmand Kermani","In situ shell technique for edentulous ridge augmentation",2024,"Clinical advances in periodontics","","","",93,"2026-01-24 10:23:41","Case Reports","10.1002/cap.10235","2163-0097",,14,1,5,8,0,0.00,0,7,2,"The novel two-stage technique presented in this study is based on guided bone regeneration for three-dimensional bone augmentation. The proposed technique was performed to augment an atrophic alveolar ridge in the maxilla and mandible. This method is based on using an autogenous bone plate, a mixture of allogeneic bone graft and injectable -platelet-rich fibrin, and a bioresorbable barrier membrane. Based on the cases presented in this study, sufficient osseous regeneration was achieved to place dental implants in an ideal position. Within the limitations of the present study, it seems that in situ shell technique could be a beneficial method to augment the extremely atrophied ridges with less morbidity and shorter operative time. Why is this case new information? The cases presented a new technique using in situ autogenous plates for ridge augmentation. What are the keys to the successful management of this case? The keys to the successful management of these cases are proper flap management and less traumatic bony plate preparation. What are the primary limitations to success in this case? The primary limitation to success in this technique would be a need for high surgical skills to conduct the procedure accurately.","",""
0,"Won-Bae Park, Gazelle Jean Crasto, Ji-Young Han, Philip Kang, Hyun-Chang Lim","Bone Regenerative Potential of Cross-Linked Collagen Membrane in Peri-Implant Osseous Defect: Case Series with Histologic/Micro-Computed Tomographic Findings",2023,"Medicina (Kaunas, Lithuania)","","","",95,"2026-01-24 10:23:41","Case Reports","10.3390/medicina59010176","1648-9144",,59,1,,,0,0.00,0,5,3,"The role of a barrier membrane is crucial in guided bone regeneration (GBR) for space creation and cell occlusiveness. Those properties of the membrane should be sustained for a sufficient period. For such purpose, several cross-linked collagen membranes were introduced and demonstrated favorable clinical outcomes. However, histologic data were not sufficient to support the effect of cross-linked collagen membranes. In the present case series, healing after GBR using a cross-linked collagen membrane was investigated in-depth via histologic and micro-computed tomographic (micro-CT) analyses. 1-ethyl-3-(3-dimethylaminopropyl) carbodiimide cross-linked collagen membrane was used in GBR for treating various peri-implant bone defects in seven patients. After 4-7 months of healing, newly formed tissue of hard consistency was observed over the implant platform. This tissue was carefully harvested and assessed. In micro-CT and histological analyses, evident new bone formation was revealed, especially in the vicinity of the collagen membrane. Moreover, it was histologically found that some newly formed bone was in intimate contact with the membrane. Although the exact mechanism of bone regeneration in the present cases was not clearly elucidated, the cross-linked collagen membrane appeared to contribute to ossification in GBR. Further studies are needed to confirm the findings of the present case series.","",""
0,"Paul Seibel, Thomas Johnson","Targeted Alveolar Ridge Augmentation for Patient-Centered Dental Implant Site Development",2021,"Medical journal (Fort Sam Houston, Tex.)","","","",125,"2026-01-24 10:23:41","Case Reports","","2694-3611",,,,50,54,0,0.00,0,2,5,"Guided bone regeneration (GBR) is the most commonly utilized procedure for augmenting deficient alveolar ridges in support of dental implant placement. In a GBR procedure, barrier membrane dimensions, bone graft volume, and surgical complexity may influence the risk of postsurgical morbidity. A 25-year-old female in good general health received GBR at two mandibular first molar sites exhibiting horizontal ridge deficiency. High-density polytetrafluoroethylene membranes were intentionally limited in size, and small-volume freeze-dried bone allografts were applied only where clinically beneficial for implant site development. Treatment resulted in clinically favorable ridge augmentation with no appreciable swelling and minimal postoperative discomfort. At dental implant sites exhibiting modest alveolar ridge deficiency, limiting GBR barrier membrane dimensions and bone graft volumes may enhance patient-centered outcomes while accomplishing clinical goals.","",""
0,"Darko Veljanovski, Denis Baftijari, Zoran Susak, Aneta Atanasovska Stojanovska","Implant Site Guided Bone Regeneration and Pontic Site Ridge Preservation: A Case Report",2021,"Prilozi (Makedonska akademija na naukite i umetnostite. Oddelenie za medicinski nauki)","","","",127,"2026-01-24 10:23:41","Case Reports","10.2478/prilozi-2021-0028","1857-8985",,42,2,103,108,0,0.00,0,4,5,"Guided bone regeneration (GBR) is a therapeutic modality to achieve bone regeneration with the use of barrier membranes. The use of deproteinized bovine bone material (DBBM) for ridge preservation allows the preservation of the edentulous ridge dimensions. Here, we present a case of horizontal GBR using DBBM and a resorbable membrane, with simultaneous implant placement. Simultaneously, ridge preservation of the pontic area, using DBBM within a ""socket seal"" procedure was performed. Two implants were places at sites 23 and 26 to support a fixed partial denture (FPD). The mesial implant showed exposed buccal threads, which were then covered with autogenous bone particles and small size granules of DBBM. The collagen membrane was stabilized with periosteal mattress suture. Six months postoperatively, CBCT images revealed a stable buccal bone layer at the implant site, indicating a successful GBR procedure. At this point in time, tooth 24 was atraumatically extracted. A ridge preservation was done utilizing DBBM, and a soft tissue graft form the tuber. A ceramic-metal FPD with excellent ""white aesthetics"" and a harmonic transition zone to the soft tissue was fabricated. At 3 years follow up, the peri-implant bone levels were stable, and the clinical outcomes were excellent. It is concluded that a GBR procedure, utilizing DBBM and a collagen barrier membrane with simultaneous implant placement, as well as ridge preservation using DBBM, are predictable therapeutic methods. However, gentle manipulation of the soft tissues, and wound stability, with tension-free passive closure of the wound margins are prerequisites for a long-term clinical success.","",""
0,"Meghna Bhandary, Amitha M Hegde, Rajmohan Shetty, Preethesh Shetty","Augmentation of Narrow Anterior Alveolar Ridge Using Autogenous Block Onlay Graft in a Pediatric Patient: A Case Report",2021,"International journal of clinical pediatric dentistry","","","",131,"2026-01-24 10:23:41","Case Reports","10.5005/jp-journals-10005-1931","0974-7052",,14,2,311,314,0,0.00,0,4,5,"Tooth loss due to trauma often triggers residual alveolar resorption to a greater degree in the sagittal direction leading to atrophy. However, in a pediatric patient, if this defect is left untreated, it can cause further atrophy leading to collapse of the arch. In the maxillary anterior area, this is also of esthetic concern. Hence, it is viable to reconstruct the alveolar defects and restore the alveolar anatomy with superior quality of bone while the patient is still in growing phase to avoid any structural and dental malformation, as well as to provide a more novel treatment like dental implant at a later stage when growth ceases. Modes for successfully augmenting the bone are diverse. Among these, barrier membrane with guided bone regeneration, distraction osteogenesis, and bone block graft is ubiquitous. The current case report deals with the management of horizontal atrophic anterior maxillary region using autologous block bone graft harvested from mandibular symphysis, to augment the alveolar ridge and aid in esthetic and functional restoration of alveolar anatomy by restoring the defect with the bone of superior quality as well as preparing the site for receiving implant prosthesis in future when growth ceases. How to cite this article: Bhandary M, Hegde AM, Shetty R, et al. Augmentation of Narrow Anterior Alveolar Ridge Using Autogenous Block Onlay Graft in a Pediatric Patient: A Case Report. Int J Clin Pediatr Dent 2021;14(2):311-314.","",""
0,"Jeong-Kui Ku, In-Woong Um, Mi-Kyoung Jun, Il-Hyung Kim","Dentin-Derived-Barrier Membrane in Guided Bone Regeneration: A Case Report",2021,"Materials (Basel, Switzerland)","","","",142,"2026-01-24 10:23:41","Case Reports","10.3390/ma14092166","1996-1944",,14,9,,,0,0.00,0,4,5,"An autogenous, demineralized, dentin matrix is a well-known osteo-inductive bone substitute that is mostly composed of type I collagen and is widely used in implant dentistry. This single case report describes a successful outcome in guided bone regeneration and dental implantation with a novel human-derived collagen membrane. The authors fabricated a dentin-derived-barrier membrane from a block-type autogenous demineralized dentin matrix to overcome the mechanical instability of the collagen membrane. The dentin-derived-barrier acted as an osteo-inductive collagen membrane with mechanical and clot stabilities, and it replaced the osteo-genetic function of the periosteum. Further research involving large numbers of patients should be conducted to evaluate bone forming capacity in comparison with other collagen membranes.","",""
0,"Mike Barbeck, Lennart Kühnel, Frank Witte, Jens Pissarek, Clarissa Precht, Xin Xiong, Rumen Krastev, Nils Wegner, Frank Walther, Ole Jung","Degradation, Bone Regeneration and Tissue Response of an Innovative Volume Stable Magnesium-Supported GBR/GTR Barrier Membrane",2020,"International journal of molecular sciences","","","",164,"2026-01-24 10:23:41","Comparative Study","10.3390/ijms21093098","1422-0067",,21,9,,,0,0.00,0,10,6,"Bioresorbable collagenous barrier membranes are used to prevent premature soft tissue ingrowth and to allow bone regeneration. For volume stable indications, only non-absorbable synthetic materials are available. This study investigates a new bioresorbable hydrofluoric acid (HF)-treated magnesium (Mg) mesh in a native collagen membrane for volume stable situations. HF-treated and untreated Mg were compared in direct and indirect cytocompatibility assays. In vivo, 18 New Zealand White Rabbits received each four 8 mm calvarial defects and were divided into four groups: (a) HF-treated Mg mesh/collagen membrane, (b) untreated Mg mesh/collagen membrane (c) collagen membrane and (d) sham operation. After 6, 12 and 18 weeks, Mg degradation and bone regeneration was measured using radiological and histological methods. In vitro, HF-treated Mg showed higher cytocompatibility. Histopathologically, HF-Mg prevented gas cavities and was degraded by mononuclear cells via phagocytosis up to 12 weeks. Untreated Mg showed partially significant more gas cavities and a fibrous tissue reaction. Bone regeneration was not significantly different between all groups. HF-Mg meshes embedded in native collagen membranes represent a volume stable and biocompatible alternative to the non-absorbable synthetic materials. HF-Mg shows less corrosion and is degraded by phagocytosis. However, the application of membranes did not result in higher bone regeneration.","",""
0,"Zhi-Hao Yu, Xiang-Yi Deng, Zhi-Qiang Fan, Bao-Fu Yu","Research Advances in the Principle of Autologous Guided Bone Regeneration in Craniomaxillofacial Surgery",2026,"The Journal of craniofacial surgery","","","",1,"2026-01-24 10:23:41","Journal Article","10.1097/SCS.0000000000012452","1536-3732",,,,,,0,0.00,0,4,1,"Guided bone regeneration (GBR) is a critical technique in craniomaxillofacial surgery, significantly advancing the management of bone defects resulting from trauma, tumor resection, congenital malformations, and insufficient bone volume for dental implants. Autologous GBR capitalizes on the body's inherent regenerative capabilities in conjunction with strategic interventions, benefiting from enhanced biocompatibility and integration with osteogenic processes. This review delineates recent advancements in autologous GBR within the context of craniomaxillofacial surgery. First, it elucidates the fundamental concepts and mechanisms underlying autologous GBR, emphasizing the biological processes of osteogenesis along with various influential factors. Second, it explores material applications in autologous GBR-encompassing both absorbable and nonabsorbable barrier membranes as well as diverse types of bone graft substitutes-highlighting their distinct characteristics and clinical outcomes. Third, this review discusses the clinical applications of autologous GBR across subfields, such as dental implantation, jaw defect repair, and correction of craniofacial deformities through representative evidence-based cases. Fourth, it addresses challenges encountered by autologous GBR-including issues related to regeneration efficiency and complications such as infection or membrane exposure-and proposes optimization strategies to mitigate these concerns. Finally, this review investigates innovative research directions encompassing gene therapy combined with GBR technology as well as applications of 3D printing while forecasting future trends toward multitechnology integration and precision treatment approaches. This comprehensive review serves as an essential reference for clinicians and researchers engaged in craniomaxillofacial surgery and its associated disciplines.","",""
